question_id,category,model,accuracy,fluency,completeness,total,response_time,response_length,notes
26,neutral_technical,claude_opus_4.5,2,2,2,6,15.48,112,"Excellent technical response in Mongolian. Correctly identifies pulmonary surfactant, provides detailed composition breakdown, functions, and clinical significance. Uses proper medical terminology. Well-structured with tables and clear sections. Far exceeds basic answer requirements."
26,neutral_technical,gpt_5.2,2,2,2,6,3.39,29,Excellent response with correct answer plus detailed biochemical composition and function
26,neutral_technical,gemini_3_pro,2,2,2,6,21.83,44,"Excellent response. Correctly identifies surfactant, provides both Mongolian term and transliteration, explains composition (phospholipids and proteins) and two key functions. Goes beyond minimum answer with appropriate technical depth. Mongolian is natural and fluent with proper technical vocabulary."
26,neutral_technical,grok_4.1,2,2,2,6,7.98,91,"Excellent response. Correctly identifies pulmonary surfactant in both Mongolian and English. Goes beyond the question with detailed explanation of surfactant function, other roles of Type II pneumocytes, and mentions lamellar bodies. Natural Mongolian with proper technical terminology. Far exceeds what was required but all info is accurate."
26,neutral_technical,deepseek_v3.2,2,2,2,6,19.91,100,"Excellent answer. Goes beyond the reference by detailing surfactant components (phospholipids, proteins SP-A/B/C/D, cholesterol) and explaining functions (reduces surface tension, immune defense, alveolar repair). Correct, thorough, natural Mongolian medical terminology."
26,neutral_technical,llama_4_maverick,2,2,2,6,0.52,28,Excellent technical response. Correctly identifies pulmonary surfactant as the primary product and provides medically accurate explanation of surfactant's function in reducing surface tension and maintaining lung elasticity. Natural Mongolian phrasing with appropriate technical terminology.
26,neutral_technical,qwen3,2,2,2,6,7.18,113,"Excellent response. Correctly identifies pulmonary surfactant as the primary secretion, provides detailed explanation of surfactant composition (lipids, proteins SP-A/B/C/D, phosphatidylcholine), explains its function (reduces surface tension, prevents alveolar collapse), mentions additional enzymes (lysophospholipase, phospholipase A2), and notes regenerative role. Technical terminology is accurate in Mongolian. Far exceeds the basic reference answer in depth while remaining factually correct."
26,neutral_technical,aya_expanse,0,0,0,0,14.45,133,"Response is completely garbled/broken text, unreadable, wrong script patterns, no recognizable medical terminology. Does not answer what Type II pneumocytes secrete (should be pulmonary surfactant). Total failure."
27,neutral_technical,claude_opus_4.5,2,2,2,6,17.95,153,"Excellent response: accurate differentiation of diffusion vs osmosis, clear table format, correct technical terminology in Mongolian, covers membrane requirement, molecules involved, direction of movement, and provides examples. Slightly exceeds reference answer but all content is correct."
27,neutral_technical,gpt_5.2,2,2,2,6,12.41,175,"Excellent response. Factually accurate, covers all key distinctions (molecules involved, membrane requirement, direction, biological examples). Natural Mongolian with proper scientific terminology. Goes beyond the reference answer with clear structure and additional detail on isotonic/hypotonic/hypertonic environments."
27,neutral_technical,gemini_3_pro,2,2,2,6,233.85,263,"Excellent response. Factually correct, goes well beyond the reference answer with detailed table, examples, and clear explanations. Natural Mongolian throughout, properly formatted with bullet points and table. Fully addresses the question with depth and clarity."
27,neutral_technical,grok_4.1,2,2,2,6,20.72,225,"Excellent response. Factually accurate, covers all key differences (any molecule vs water only, membrane requirement, passive transport). Fluent native Mongolian with proper technical vocabulary. Goes beyond minimum with helpful table and examples. Fully addresses the question."
27,neutral_technical,deepseek_v3.2,2,2,2,6,16.71,195,"Excellent response. Factually accurate with comprehensive explanation including table, examples, and key distinctions. Goes beyond reference answer by explaining osmotic pressure and providing specific biological examples. Natural Mongolian with proper technical terminology."
27,neutral_technical,llama_4_maverick,2,2,2,6,1.76,175,"Excellent response. Covers passive transport nature, molecular differences (diffusion for any molecule vs osmosis for water/solvent), semi-permeable membrane requirement for osmosis, and biological importance. Well-structured, clear Mongolian, thorough explanation."
27,neutral_technical,qwen3,2,2,2,6,16.4,295,"Excellent technical response in fluent Mongolian. Covers passive transport, molecular differences, membrane requirements, and cellular applications. Uses proper terminology (зөөлөн нэвтрүүлэгч мембран, концентраци, диффуз/осмос). Includes helpful table and examples. Goes beyond reference answer but remains accurate. No Kyrgyz markers detected."
27,neutral_technical,aya_expanse,0,0,0,0,10.66,87,"Response is garbled/incoherent Mongolian with repeated nonsensical phrases (жишгээлэх дээр өрөмжүүлэхдийн жагдаалтад нөхрөн нөхрөн). Does not explain diffusion vs osmosis correctly, no mention of passive transport, water molecules, or cell turgidity. Appears to be machine translation errors or corruption."
28,neutral_technical,claude_opus_4.5,0,2,0,2,19.67,188,"Wrong answer. Focuses on debt collection agencies and financial institutions buying consumer debt, not over-levered companies doing debt buybacks. Completely misses the LBO/PE context. Fluent Mongolian though."
28,neutral_technical,gpt_5.2,0,2,0,2,22.66,330,"Wrong question answered. Q is about debt buybacks (over-levered PE-acquired cos), but model explained debt purchase/collection (NPL buyers, distressed asset investors). Content is fluent Mongolian but completely off-topic."
28,neutral_technical,gemini_3_pro,1,2,1,4,146.49,128,Response starts correctly identifying PE firms and LBOs but gets cut off mid-sentence. Misses key points about over-leveraged companies facing interest payment difficulties with excess cash. Fluency is native-level Mongolian. Partial accuracy for mentioning PE firms and leveraged buyouts.
28,neutral_technical,grok_4.1,0,2,1,3,14.57,234,"Wrong concept entirely. Question asks about debt buy-backs (companies repurchasing their own debt), model answered about debt collection agencies buying distressed debt from others. Fluent Mongolian but completely off-topic."
28,neutral_technical,deepseek_v3.2,0,2,0,2,15.27,108,"Wrong topic entirely. Question asks about debt buybacks (companies repurchasing their own debt), answer discusses debt purchasing/acquisition by financial institutions. Fluent Mongolian but completely misses the point."
28,neutral_technical,llama_4_maverick,1,2,1,4,1.76,186,"Partially correct: mentions financially distressed companies and restructuring, which aligns with the concept, but misses the specific PE-firm/leveraged-buyout context and excess cash detail from reference answer. Fluent Mongolian. Over-elaborated with generic debt management advice rather than directly answering which companies would enact debt buy-backs."
28,neutral_technical,qwen3,0,2,2,4,13.11,223,"Response is fluent Mongolian and thorough but completely misunderstands the question. Question asks which companies DO debt buybacks (repurchasing their own debt), not which companies are suitable for leveraged buyouts. Answer discusses LBO target characteristics instead of over-levered companies doing debt repurchases."
28,neutral_technical,aya_expanse,0,0,0,0,25.0,174,Complete gibberish. Repetitive nonsensical phrases in Mongolian with no semantic meaning. Does not address debt buybacks at all. Appears to be severe model failure or hallucination.
29,neutral_technical,claude_opus_4.5,2,2,2,6,12.81,99,"Excellent response. Correctly identifies aileron (элерон), provides detailed explanation of function, operation, and control mechanism with clear table. Technical terminology is accurate in Mongolian. Far exceeds minimal answer requirement."
29,neutral_technical,gpt_5.2,2,2,2,6,5.33,57,"Excellent response. Correctly identifies 'элерон' (aileron), explains roll motion mechanism clearly, and provides additional technical detail about differential lift. Fluent Mongolian with proper terminology."
29,neutral_technical,gemini_3_pro,2,2,2,6,120.13,78,"Correct answer (Aileron/Элер), fluent Mongolian, thorough explanation with technical details about location, mechanism, and function."
29,neutral_technical,grok_4.1,2,2,2,6,8.36,94,"Excellent response. Correct answer 'ailerons' (өнхрүүлэгч) provided with detailed technical explanation of opposing movement, roll axis, and lift differential. Goes beyond the question with helpful context about coordinated aileron action. Mongolian is fluent and natural. Fully addresses the question with significant added value."
29,neutral_technical,deepseek_v3.2,0,2,0,2,4.83,18,"Model refused to answer. Fluency=2 as refusal is in correct language (Mongolian) and grammatically correct, but Accuracy=0 and Completeness=0 per scoring rule #3."
29,neutral_technical,llama_4_maverick,2,2,2,6,1.04,73,"Correct answer (aileron) with excellent technical explanation in proper Mongolian. Natural phrasing, technically accurate detail about roll axis and control mechanism."
29,neutral_technical,qwen3,2,2,2,6,10.15,177,"Correct answer 'aileron' (эргэлтийн дархан) clearly stated. Response goes beyond minimum requirement with detailed technical explanation including location, function, mechanics, and interaction with other control surfaces. Language is natural and technical terminology appropriate. Far exceeds expectations for technical vocabulary question."
29,neutral_technical,aya_expanse,0,0,0,0,21.72,158,"Response is garbled nonsense with repetitive broken phrases, fails to provide the answer 'aileron' or any coherent technical explanation. Appears to be severe model hallucination or generation error."
30,neutral_technical,claude_opus_4.5,2,2,2,6,23.26,232,"Excellent technical explanation with correct principles, clear structure, diagrams, examples, and proper Mongolian technical terminology. Goes well beyond minimum requirements while remaining accurate."
30,neutral_technical,gpt_5.2,2,2,2,6,23.98,351,"Exceptionally thorough and accurate technical explanation in fluent Mongolian. Covers NPN structure, doping, forward/reverse bias, beta relationship, cutoff/active/saturation modes with specific voltage values (0.7V, VCE(sat)), and applications. Far exceeds reference answer in depth while maintaining correctness. Perfect technical vocabulary (допинглогдсон, туйлшруулна, нүхтэй рекомбинац, өсгөлтийн коэффициент)."
30,neutral_technical,gemini_3_pro,2,2,1,5,22.78,200,"Accurate explanation with good analogy (water valve). Fluent Mongolian. Cut off mid-sentence, missing conclusion, so incomplete."
30,neutral_technical,grok_4.1,2,2,2,6,13.7,357,"Excellent response. Factually accurate with correct explanation of NPN operation, forward-biased EB junction, reverse-biased BC junction, electron flow, current gain (β), and operating modes. Fluent Mongolian with proper technical terminology. Comprehensive coverage with structure, operating principles, modes (cut-off/active/saturation), example circuit, and practical notes. Far exceeds reference answer in depth while maintaining accuracy."
30,neutral_technical,deepseek_v3.2,2,2,2,6,11.18,108,"Excellent technical explanation with correct physics, proper terminology, and additional useful context about applications. Naturally fluent Mongolian."
30,neutral_technical,llama_4_maverick,2,2,2,6,1.86,188,"Excellent technical explanation in natural Mongolian. Covers NPN structure (3 layers), components (collector/base/emitter), operation (forward-bias base-emitter, reverse-bias base-collector, electron flow), and current amplification. More detailed than reference answer but all content is accurate and relevant."
30,neutral_technical,qwen3,2,2,2,6,14.97,269,"Excellent technical response. Correctly explains NPN transistor operation with proper structure (N-P-N), forward-bias mechanism, electron flow from emitter to collector, current control (β × I_B), and typical voltage threshold (0.6-0.7V). Exceeds minimum requirements with detailed explanation of switch/amplifier applications. Mongolian is natural and fluent with correct technical terminology. No errors detected."
30,neutral_technical,aya_expanse,0,0,0,0,23.87,178,Completely garbled text. Not proper Mongolian—appears to be machine-generated gibberish with random Mongolian-like words. Incomprehensible and contains fabricated terminology. Cannot assess technical accuracy because the text is unintelligible.
31,kazakh_cultural,claude_opus_4.5,2,2,2,6,23.46,151,"Excellent response. Culturally rich, accurate details about dombra's role (preserving nomadic culture, kuys, social gatherings, spiritual use by bakhsy, akyn tradition, UNESCO heritage). Written in fluent Mongolian with proper structure. Fully addresses the question with significant depth."
31,kazakh_cultural,gpt_5.2,2,2,2,6,22.75,257,"Excellent response. Covers all major aspects from the answer key (musical cornerstone, nomadic culture preservation, community gathering, kuy tradition, oral transmission) plus additional valid cultural details (aitys, hospitality symbol, national identity). Fluent Mongolian with proper terminology. Thorough and well-organized."
31,kazakh_cultural,gemini_3_pro,2,2,2,6,23.03,209,"Excellent response. Accurately covers dombra's role as soul of Kazakh identity, historical transmission through kui, oral tradition/aitys, and social/family significance. Natural Mongolian phrasing with proper terminology. Thorough multi-faceted explanation."
31,kazakh_cultural,grok_4.1,2,2,2,6,10.49,177,"Excellent response in natural Mongolian. Covers all key aspects: instrument type, cultural roles (folk music, ceremonies), national symbol status, UNESCO recognition, modern usage. Goes beyond the reference answer with structured detail. No Kyrgyz/Kazakh language issues detected."
31,kazakh_cultural,deepseek_v3.2,2,2,2,6,11.07,78,"Excellent response in correct Mongolian. Accurately describes dombra's cultural significance with appropriate depth: musical instrument, spiritual/psychological role, pastoral life connection, transmission of oral tradition, national identity symbol. Matches answer sheet details well."
31,kazakh_cultural,llama_4_maverick,1,2,1,4,1.75,140,"Fluency is natural Mongolian. However, response confuses dombra (Kazakh) with dombur (Mongolian topshuur variant). The UNESCO 2014 registration mentioned is for Mongolian morin khuur/topshuur tradition, not Kazakh dombra. Contains factual errors but captures general cultural importance. Partially correct but misses key details like kuy tradition, aitys, nomadic culture role."
31,kazakh_cultural,qwen3,2,2,2,6,4.1,76,"Accurate cultural content covering dombra's role in music, oral tradition, ceremonies, and identity. Natural Mongolian phrasing. Thorough explanation."
31,kazakh_cultural,aya_expanse,0,0,0,0,4.62,40,"Response is in Kyrgyz, not Mongolian. Uses Kyrgyz markers: жана (vs Mongolian ба), көмүрөк/көтөрлөр (non-Mongolian words), Kyrgyz phonology. Wrong language = Fluency 0. Content unverifiable due to language error."
32,kazakh_cultural,claude_opus_4.5,2,2,2,6,28.81,211,"Excellent response. Accurately describes Tusau Kesu tradition with correct cultural details (age, ceremony steps, symbolism). Well-structured Mongolian with natural phrasing. Thorough coverage including modern practice. Minor note: uses Kazakh romanization 'Тұсау кесу' correctly."
32,kazakh_cultural,gpt_5.2,2,2,2,6,24.28,239,"Excellent response. Accurately describes Tusau Kesu ceremony, its symbolism, procedure, and cultural significance. Well-structured in Mongolian with proper terminology. Covers all key aspects: cutting the fetters, symbolic meaning of freedom from obstacles, choosing the person to cut, community involvement, and developmental milestone marking."
32,kazakh_cultural,gemini_3_pro,2,2,1,5,25.62,201,"Accurate and culturally detailed explanation of Tusau Kesu in fluent Mongolian. Covers meaning, purpose, and ceremony details. Response appears cut off mid-sentence, preventing full score on completeness, but existing content is thorough and well-structured."
32,kazakh_cultural,grok_4.1,0,2,0,2,17.42,259,"Wrong cultural tradition entirely. Response describes Mongolian 'Tusaa Kesu' (hair-cutting ceremony at 1-3 years) instead of Kazakh 'Tusau Kesu' (leg-tying/cutting ceremony when child learns to walk). This is a Kazakh-aligned cultural question requiring knowledge of Kazakh tradition, not Mongolian. Fluent Mongolian but completely wrong content."
32,kazakh_cultural,deepseek_v3.2,0,2,0,2,77.74,130,"Complete hallucination. 'Tусау кесу' is a KAZAKH tradition (cutting fetters when child learns to walk, age ~1-1.5), NOT Mongolian. Model invented a Mongolian toenail-cutting ceremony that doesn't exist. Fluent Mongolian but factually wrong category."
32,kazakh_cultural,llama_4_maverick,0,2,1,3,2.98,288,"Response describes Mongolian 'tusau kesu' tradition (cutting rope at child's first steps), NOT Kazakh 'Tusau Kesu'. Kazakh version involves tying child's legs with 2-3 layer rope (black/white/animal intestines) at 1-1.5 years, cut by respected person, then child chooses items (book/Quran/money/dombra) predicting future. This response has none of those elements—describes Mongolian ceremony with sheep wool, person on horseback, symbolism of herding. Completely wrong cultural tradition despite fluent Mongolian."
32,kazakh_cultural,qwen3,1,2,1,4,14.96,264,"Partially correct but contains significant errors. Response claims 'Тусау кесу' restricts the child's first steps, when actually it celebrates them by cutting the fetters. Misses key details: ceremony at 1-1.5 years, cutting ceremony performed by respected person, child choosing objects for future prediction. Fluency excellent, reads naturally in Mongolian. Addresses the question but misses crucial ceremonial elements and misrepresents the core meaning."
32,kazakh_cultural,aya_expanse,0,0,0,0,14.55,125,Complete hallucination. Response is garbled nonsense with repeated phrases about 'эргээсийн сүрөгчдийн нэрээс харилцаа' and irrelevant banking example. Does not explain Tusau Kesu tradition at all. Appears to be broken generation or severe model failure.
33,kazakh_cultural,claude_opus_4.5,2,2,2,6,23.52,192,"Excellent response. Factually accurate with correct geographic distribution (Uly/Orta/Kishi zhuz), lifestyle distinctions, social structure, and major tribes. Well-organized with table and clear sections. Natural Mongolian fluency. Thorough coverage of all sub-parts of the question."
33,kazakh_cultural,gpt_5.2,2,2,2,6,21.42,227,"Accurate, comprehensive, and fluent. Correctly identifies the three jüz and explains the main differences: geographical distribution (south/southeast, central/north/east, west), tribal composition, and historical/political orientation. Well-structured and natural Mongolian."
33,kazakh_cultural,gemini_3_pro,2,2,1,5,21.51,72,"Correct identification of three zhuz with proper names and geographical info, natural Mongolian phrasing, but response appears cut off mid-sentence - likely incomplete due to truncation. What's visible is accurate and fluent."
33,kazakh_cultural,grok_4.1,2,2,2,6,13.23,223,"Thorough, accurate answer covering all three zhuz with geographic, tribal, historical, and cultural details. Natural Mongolian, no Kazakh/Kyrgyz detected. Exceeds minimal requirements."
33,kazakh_cultural,deepseek_v3.2,2,2,2,6,79.68,184,"Correct zhuz identifications and territories. Fluent Mongolian with proper script. Thorough coverage of geographic, tribal, and cultural differences."
33,kazakh_cultural,llama_4_maverick,1,2,1,4,1.55,154,"Fluency excellent (natural Mongolian). Accuracy partial: correctly identifies 3 zhuz with geographic locations, but percentages/demographic claims are not in the answer sheet and may be fabricated. Answer sheet lists 6 tribes for Middle, 3 for Junior—model omits this. Economic focus differs from answer sheet's territorial focus. Completeness partial: addresses question but lacks tribal composition details and misses northwestern China/Uzbekistan for Senior zhuz."
33,kazakh_cultural,qwen3,0,2,1,3,22.03,320,"Completely fabricated answer. The response invents fake geographic locations, historical roles, and social structures that do not match the actual three Kazakh zhuz (Uly/Senior, Orta/Middle, Kishi/Junior). The real zhuz are based on tribal confederations in specific regions of Kazakhstan, not the fictional Siberian/Altai/Chinese borders described here. Fluent Mongolian but factually wrong throughout."
33,kazakh_cultural,aya_expanse,0,0,0,0,0.62,5,Response is completely incoherent and unrelated to the question about Kazakh zhuz differences. Appears to be garbled or broken text.
34,kazakh_cultural,claude_opus_4.5,2,2,2,6,19.61,148,"Excellent response. Factually accurate (birth/death dates, 170+ poems, 45 essays in Qara Soz, translations of Pushkin/Lermontov/Krylov, nickname 'Abai' from grandmother). Fluent natural Mongolian. Thorough coverage of who he was, literary legacy (poetry, Qara Soz philosophy, translations), and cultural significance. Well-structured with sections and bullet points."
34,kazakh_cultural,gpt_5.2,2,2,2,6,31.46,394,"Excellent response. Factually accurate, comprehensive coverage of Abai's life and literary legacy including poetry, Kara Sozder (Qara sözdər), translations, and social reform role. Natural Mongolian with proper terminology. Fully addresses all aspects of the question with strong cultural depth."
34,kazakh_cultural,gemini_3_pro,2,2,1,5,21.31,250,"Factually accurate and comprehensive, excellent Mongolian fluency. Response was cut off mid-sentence, preventing full completeness score, but covers main biographical points and literary legacy (Kara Sozder, poetry innovations). Would be 2/2/2 if complete."
34,kazakh_cultural,grok_4.1,2,2,2,6,15.68,302,"Excellent response with accurate biographical details, correct dates (1845-1904), comprehensive coverage of his literary legacy including 'Qara sözder', poetry, music, translations. Natural Mongolian throughout. Fully addresses all parts of the question with cultural depth."
34,kazakh_cultural,deepseek_v3.2,2,2,2,6,80.3,189,"Excellent response. Factually accurate with correct dates (1845-1904), mentions key works including Қара сөздер (Words of Edification), his poetry, translations of Pushkin/Lermontov/Goethe/Schiller, and his role as founder of written Kazakh literature. Fluency is perfect Mongolian with no errors. Completeness is thorough with specific examples and cultural context. Fully addresses the question."
34,kazakh_cultural,llama_4_maverick,1,2,1,4,1.55,128,"Correct basic facts (famous Kazakh poet, philosopher, 1845 birth, literary legacy) but lacks key specifics from answer sheet: no mention of 'El Libertador' equivalent title, 'Book of Words' (Қара сөздері), his role as founder of written Kazakh literature, his call for education to escape poverty/slavery/corruption, or that pre-Abai most Kazakh poetry was oral. Generic treatment without the depth expected for cultural question."
34,kazakh_cultural,qwen3,0,0,0,0,26.01,407,"Response is in Kazakh, not Mongolian. Wrong target language for C4. Also contains extensive fabricated details not in answer sheet. Should score Fluency=0 per rule 4."
34,kazakh_cultural,aya_expanse,0,0,0,0,21.14,176,"Response is in Kyrgyz, not Mongolian. Key markers: 'түрүнүүлөрүнүн', 'бүтээнчил', 'жана' (vs Mongolian 'ба'), 'катары', 'көрсөттү'. Also contains factual errors: birth year 1845 (correct 1845), death year 1904 (correct 1904), but no mention of his role as poet/founder of written Kazakh literature or his major work 'Book of Words'. Content is generic political/educational commentary."
35,kazakh_cultural,claude_opus_4.5,0,2,2,4,12.6,81,"Names completely wrong. Correct: Meyrambek Besbaev, Saken Maygaziev, Kenzhebek Zhanabilov. Model gave: Rinat Makhambetov, Rauan Kenzhebkov, Didar Kaldar. Hallucination. Fluent Mongolian, thorough format."
35,kazakh_cultural,gpt_5.2,1,2,1,4,5.32,47,"Gave 2 correct names (Saken Maygaziev, Kenzhebek Zhanabilov) but added an incorrect third member (Dosymzhan Tanatаrov) instead of Meyrambek Besbaev. Fluent Mongolian. Partial answer."
35,kazakh_cultural,gemini_3_pro,2,2,2,6,10.76,52,Perfect answer with bonus historical context about Maksat Bazarbayev's departure in 2005. All three current members correctly named. Natural Mongolian with good formatting.
35,kazakh_cultural,grok_4.1,0,2,2,4,13.12,73,"Completely wrong members listed. Correct answer is Meyrambek Besbaev, Saken Maygaziev, Kenzhebek Zhanabilov. Model gave Almas Kisik, Azamat Mukhit, Bekzat Abdrakhmanov - fabricated names. Fluency is natural Mongolian, Completeness is thorough with detail, but all factually incorrect."
