question_id,category,model,accuracy,fluency,completeness,total,response_time,response_length,notes
13,neutral_reasoning,deepseek_v3.2,1,2,0,3,21.84,610,"Fluency is natural Mongolian. Accuracy=1: reasoning is correct (A+B=28, C=56) but no final answer given. Completeness=0: response cuts off mid-thought, never states what each person pays."
13,neutral_reasoning,llama_4_maverick,0,2,1,3,0.74,58,"Wrong logic and final answer. Model assumes 3 people total but should be 3 friends (denominator should be 4, not 3). Correct answer is $42 and $21 each, not $28 and $56. Fluency is natural Mongolian. Partial completeness as it attempts full reasoning but reaches wrong conclusion."
13,neutral_reasoning,qwen3,2,2,2,6,5.33,125,Correct answer with clear step-by-step work. Natural Mongolian phrasing with proper mathematical notation.
13,neutral_reasoning,aya_expanse,0,1,1,2,3.29,42,"Wrong logic and wrong answer. Model calculates $28 per person initially, then tries $56 for one person, but this is garbled and incorrect. Correct answer is $42/$21/$21. Response is in Mongolian and somewhat understandable but logically broken."
14,neutral_reasoning,claude_opus_4.5,2,2,2,6,11.2,81,"Perfect answer with excellent explanation. Correctly identifies the person is short, can only reach 7th floor button, and uses umbrella in rain to reach 10th. Well-structured, clear, natural Mongolian."
14,neutral_reasoning,gpt_5.2,2,2,2,6,3.6,42,"Perfect answer with excellent explanation in natural Mongolian. Correctly identifies height issue, umbrella solution, and walking remaining floors."
14,neutral_reasoning,gemini_3_pro,2,2,2,6,10.87,40,Correct answer with proper reasoning. Clear explanation in natural Mongolian. Covers all parts including umbrella detail.
14,neutral_reasoning,grok_4.1,2,2,2,6,3.81,32,Perfect answer with correct logic and final answer. Explains both the shortness and the umbrella workaround. Natural Mongolian with appropriate emoji.
14,neutral_reasoning,deepseek_v3.2,0,2,1,3,141.0,49,"Wrong reasoning: claims umbrella protects from rain risk, not that person is short and uses umbrella to reach button. Final answer incorrect despite addressing all parts of question."
14,neutral_reasoning,llama_4_maverick,2,2,2,6,0.83,36,Perfect answer with correct logic and natural Mongolian phrasing.
14,neutral_reasoning,qwen3,2,2,2,6,4.51,83,Correct answer with proper logic. Naturally fluent Mongolian. Thorough explanation with multiple wordings.
14,neutral_reasoning,aya_expanse,0,0,0,0,12.4,122,"Complete nonsense response. Garbled text, no coherent meaning, fails to answer the riddle. Should explain person is short and can't reach 10th button without umbrella."
15,neutral_reasoning,claude_opus_4.5,2,2,2,6,14.29,179,Perfect solution with clear step-by-step explanation in fluent Mongolian. Includes helpful table and formatting. Correctly identifies the key insight about burning from both ends.
15,neutral_reasoning,gpt_5.2,2,2,2,6,6.17,122,"Perfect answer with clear step-by-step explanation in natural Mongolian. Correctly identifies lighting rope A from both ends and rope B from one end, then lighting B's other end after 30min to measure exactly 45min total."
15,neutral_reasoning,gemini_3_pro,2,2,2,6,16.71,112,Perfect answer with correct logic and clear step-by-step explanation in natural Mongolian.
15,neutral_reasoning,grok_4.1,2,2,2,6,12.2,136,"Perfect answer with detailed step-by-step explanation in fluent Mongolian. Correctly identifies lighting rope A from both ends and rope B from one end, then lighting B's other end after 30 minutes to measure exactly 45 minutes."
15,neutral_reasoning,deepseek_v3.2,2,2,2,6,9.33,129,Correct logic and correct final answer with detailed step-by-step explanation. Fluent native-level Mongolian. Fully addresses the question.
15,neutral_reasoning,llama_4_maverick,2,2,2,6,0.62,49,Perfect solution with clear step-by-step explanation in fluent Mongolian. Correctly burns rope 1 from both ends (30 min) then rope 2's other end (15 min) = 45 min total.
15,neutral_reasoning,qwen3,2,2,2,6,15.99,298,Correct logic and answer. Natural Mongolian. Full step-by-step explanation with clear reasoning.
15,neutral_reasoning,aya_expanse,0,0,0,0,45.81,628,Complete system failure - response is repetitive gibberish with no actual answer to the rope-burning puzzle. Text repeats the same broken phrases endlessly with no logical solution provided.
16,neutral_reasoning,claude_opus_4.5,2,2,2,6,8.65,83,Perfect answer with clear explanation and visual aids in correct Mongolian
16,neutral_reasoning,gpt_5.2,2,2,2,6,2.42,31,Correct answer (3) with clear logical explanation in natural Mongolian
16,neutral_reasoning,gemini_3_pro,2,2,2,6,6.15,8,"Correct answer (3), natural Mongolian, adds helpful visualization 'they are in a row'"
16,neutral_reasoning,grok_4.1,0,2,1,3,4.53,15,Wrong answer: 5 instead of correct 3. Fluent Mongolian but misunderstood the logic puzzle's overlapping structure.
16,neutral_reasoning,deepseek_v3.2,0,2,0,2,21.86,619,"Response is in perfect Mongolian but provides no final answer. It endlessly analyzes the problem (trying 5, then 6, then reconsidering) but never concludes with the correct answer of 3. The model got stuck in a reasoning loop and failed to deliver the answer."
16,neutral_reasoning,llama_4_maverick,2,2,2,6,0.32,14,"Correct answer (3 ducks), clear explanation, natural Mongolian phrasing"
16,neutral_reasoning,qwen3,2,2,2,6,15.37,351,Correct final answer (3 ducks). Thorough logical breakdown with step-by-step verification. Natural Mongolian fluency throughout the explanation.
16,neutral_reasoning,aya_expanse,0,1,1,2,2.78,28,"Answer is incorrect (5 instead of 3). Logic is flawed. Fluency is poor—awkward phrasing, unclear meaning, but recognizable Mongolian. Partially addresses the question but with wrong reasoning."
17,neutral_reasoning,claude_opus_4.5,2,2,2,6,8.97,146,"Correct answer (CABDE), clear logical reasoning, natural Mongolian with proper formatting"
17,neutral_reasoning,gpt_5.2,2,2,2,6,3.24,58,Correct answer CABDE with clear logical reasoning shown step-by-step in fluent Mongolian
17,neutral_reasoning,gemini_3_pro,2,2,2,6,151.06,52,Correct answer CABDE with clear step-by-step reasoning in natural Mongolian. Fully addresses the logic puzzle.
17,neutral_reasoning,grok_4.1,2,2,2,6,4.62,60,"Correct final answer (CABDE) with clear, step-by-step explanation in natural Mongolian"
17,neutral_reasoning,deepseek_v3.2,2,2,2,6,133.2,57,Correct answer CABDE with clear logical explanation in natural Mongolian
17,neutral_reasoning,llama_4_maverick,2,2,2,6,0.83,124,"Correct answer (CABDE), clear logical reasoning, excellent Mongolian fluency with proper explanation of constraints and step-by-step deduction."
17,neutral_reasoning,qwen3,2,2,2,6,7.18,169,"Perfect logic, correct answer (CABDE), natural Mongolian with step-by-step reasoning"
17,neutral_reasoning,aya_expanse,0,1,0,1,4.42,56,Incorrect answer and logic. Should be CABDE. Response is confusing/nonsensical. Says 'дараалал 4 байсан' (order was 4?) which is meaningless. Partial fluency as Mongolian is readable but content is garbled.
18,neutral_reasoning,claude_opus_4.5,2,2,2,6,10.04,100,"Excellent logical reasoning with case analysis, correct final answer, natural Mongolian phrasing with clear structure"
18,neutral_reasoning,gpt_5.2,2,2,2,6,4.62,64,Perfect answer with clear logical reasoning covering both cases. Explains why the answer is necessarily yes regardless of Anne's marital status.
18,neutral_reasoning,gemini_3_pro,2,2,2,6,18.44,59,"Perfect logic, correct answer with full explanation of both cases. Natural Mongolian."
18,neutral_reasoning,grok_4.1,0,2,2,4,12.2,32,"Wrong answer. Correct logic requires case analysis: if Anne is married, she looks at George (unmarried); if Anne is unmarried, Jack (married) looks at her. Either way, a married person looks at an unmarried person. Model gave detailed reasoning but reached incorrect conclusion."
18,neutral_reasoning,deepseek_v3.2,2,2,2,6,146.35,58,Perfect logic and explanation in natural Mongolian
18,neutral_reasoning,llama_4_maverick,2,2,2,6,0.74,73,"Perfect logic walkthrough, correct conclusion, natural Mongolian."
18,neutral_reasoning,qwen3,2,2,2,6,8.51,172,Perfect reasoning and correct answer. Clear case analysis covering both scenarios. Natural Mongolian throughout.
18,neutral_reasoning,aya_expanse,1,1,1,3,6.57,70,"Logic partially correct but confusing. States 'Anna is married' as fact when it's unknown. Should use case analysis: if Anna married→she looks at unmarried George; if Anna unmarried→married Jack looks at her. Conclusion correct but reasoning flawed. Fluency issues: 'нээвэрлэлтэй' (open/obvious) is odd/unnatural here, phrasing awkward."
19,neutral_reasoning,claude_opus_4.5,2,2,2,6,9.04,80,"Perfect answer with thorough explanation, correct logic, natural Mongolian"
19,neutral_reasoning,gpt_5.2,2,2,2,6,1.55,21,Correct answer with clear logical reasoning in natural Mongolian
19,neutral_reasoning,gemini_3_pro,2,2,2,6,1032.84,21,"Perfect response: correct answer 'Yes' in Mongolian, correct logical reasoning, natural fluency, fully addresses the question"
19,neutral_reasoning,grok_4.1,2,2,2,6,7.49,36,Correct answer with proper logical reasoning (syllogism). Natural Mongolian with good cultural touch (Socrates quote). Goes beyond minimum but appropriately.
19,neutral_reasoning,deepseek_v3.2,2,2,2,6,144.57,27,Correct answer with proper logical reasoning. Natural Mongolian phrasing. Fully explains the syllogism.
19,neutral_reasoning,llama_4_maverick,2,2,2,6,0.52,42,Correct answer with clear logical explanation. Natural Mongolian phrasing. Thorough breakdown of the syllogism.
19,neutral_reasoning,qwen3,2,2,2,6,2.27,34,"Correct logic and answer, natural Mongolian phrasing, thorough explanation with clear reasoning steps"
19,neutral_reasoning,aya_expanse,0,0,0,0,11.17,102,"Garbled text, wrong script/encoding, completely unreadable. Not Mongolian Cyrillic. Does not answer the simple yes/no logic question."
20,neutral_reasoning,claude_opus_4.5,2,2,2,6,11.8,129,"Correct answer 'No' with excellent logical explanation, truth table, and identification of the logical fallacy. Natural Mongolian."
20,neutral_reasoning,gpt_5.2,2,2,2,6,3.7,78,Correct answer 'Үгүй' (No) with excellent logical explanation including contrapositive reasoning in fluent Mongolian
20,neutral_reasoning,gemini_3_pro,2,2,2,6,11.68,36,Correct answer (Үгүй/No) with proper logical explanation. Natural Mongolian. Fully addresses the question.
20,neutral_reasoning,grok_4.1,2,2,2,6,7.59,140,"Correct final answer (No/Үгүй) with excellent logical explanation of why the inference is invalid, including contrapositive vs. invalid converse, symbolic notation, and concrete example. Far exceeds expectations."
20,neutral_reasoning,deepseek_v3.2,2,2,2,6,12.59,50,"Excellent response. Correctly identifies the logical fallacy (denying the antecedent), explains why the conclusion is invalid, and provides clear reasoning in natural Mongolian. Fully addresses the question with proper logical analysis."
20,neutral_reasoning,llama_4_maverick,2,2,2,6,0.52,41,Correct answer (No) with clear logical explanation. Natural Mongolian. Fully addresses the logical fallacy.
20,neutral_reasoning,qwen3,0,0,0,0,23.97,101,"Model response severely corrupted with thousands of repeated 'оороо' characters, making it unreadable and unusable. The beginning shows correct logical reasoning (A→K analysis, contrapositive explanation) but text degenerates into gibberish. Total failure."
20,neutral_reasoning,aya_expanse,1,0,1,2,5.05,58,Correct final answer 'үгүй' but broken/garbled fluency with nonsensical repeated phrases like 'тусламын сүрөгчүүд нээхгүй байгаа'. Logic is partially correct but explanation is confusing.
21,neutral_technical,claude_opus_4.5,2,2,2,6,23.57,257,"Excellent technical response in fluent Mongolian. Covers TCP/UDP differences comprehensively with clear examples, tables, diagrams, and use cases. Technical terms properly translated. Well-structured and thorough."
21,neutral_technical,gpt_5.2,2,2,2,6,14.18,213,"Excellent technical explanation in Mongolian with proper terminology, detailed comparisons, and clear use cases. Covers all key differences between TCP and UDP comprehensively."
21,neutral_technical,gemini_3_pro,2,2,2,6,1046.67,262,"Excellent response. Comprehensive, accurate, well-structured with clear explanations and comparison table. Fluent Mongolian throughout."
21,neutral_technical,grok_4.1,2,2,2,6,7.29,198,"Excellent response. Factually accurate, comprehensive comparison table, natural Mongolian technical terminology, covers all key TCP/UDP differences including connection model, reliability, speed, use cases. Well-structured and thorough."
21,neutral_technical,deepseek_v3.2,2,2,2,6,17.14,195,"Excellent technical explanation with correct terminology, comprehensive comparison table, and practical examples. Fully addresses TCP vs UDP differences with appropriate technical depth."
21,neutral_technical,llama_4_maverick,2,2,2,6,1.55,150,"Excellent technical explanation covering TCP/UDP differences, reliability, connection-oriented vs connectionless, ordering, with practical examples. Natural Mongolian with proper technical vocabulary."
21,neutral_technical,qwen3,2,2,2,6,18.24,329,"Excellent technical explanation with clear structure, correct terminology, and comprehensive coverage of all major differences. Includes helpful table and examples. Natural Mongolian."
21,neutral_technical,aya_expanse,0,0,0,0,17.92,145,"Response is completely garbled and unreadable. Text appears corrupted with nonsensical character sequences (хөлдөгчүнүү, өзөгчлөөрүн, таалгайлдаа, бүртгэлтлэхсэн, йрмийг). Not in any recognizable language. Impossible to assess content accuracy. Total failure."
22,neutral_technical,claude_opus_4.5,2,2,2,6,22.64,224,"Excellent technical response with clear explanation, practical examples, use cases across multiple fields, and even Python code. Mongolian is fluent and natural. Fully addresses what Monte Carlo simulation is and when it's used."
22,neutral_technical,gpt_5.2,2,2,2,6,22.25,308,"Excellent technical explanation with correct terminology, clear structure, multiple use cases, and discussion of advantages/limitations. Fully addresses both 'what' and 'when' parts of the question."
22,neutral_technical,gemini_3_pro,2,2,2,6,22.02,268,"Excellent response. Accurate definition of Monte Carlo simulation with clear explanation of randomness and probability distributions. Covers multiple real-world applications (finance, project management, engineering, science, insurance) with concrete examples. Well-structured, natural Mongolian, comprehensive answer. Response appears cut off at the very end but all essential content is complete."
22,neutral_technical,grok_4.1,2,2,2,6,12.62,235,"Excellent technical explanation with correct Monte Carlo definition, history, methodology, applications across multiple domains, and practical tools. Fluent Mongolian with proper technical vocabulary. Fully addresses both parts of the question."
22,neutral_technical,deepseek_v3.2,2,2,2,6,11.28,95,"Excellent response. Accurate definition, correct technical vocabulary, fluent Mongolian, comprehensive examples across finance/engineering/project management/science/insurance. Fully answers both 'what' and 'when'. Matches or exceeds reference quality."
22,neutral_technical,llama_4_maverick,2,2,2,6,1.4,102,"Excellent response: accurate definition covering random sampling and probability distributions, correctly explains when/why it's used (finance, risk analysis, complex systems), well-structured with concrete use cases, fluent Mongolian with proper technical terminology."
22,neutral_technical,qwen3,2,2,2,6,20.9,351,"Excellent technical explanation with correct terminology, clear examples across multiple fields, proper discussion of principles/advantages/disadvantages. Fully fluent Mongolian with appropriate technical vocabulary and natural phrasing throughout."
22,neutral_technical,aya_expanse,0,0,0,0,13.32,130,"Response is nearly unintelligible garbled text in Mongolian. Contains nonsensical phrases like 'эргээс эсвэл' (repeatedly), 'нэрмэлт тулгуурдаг', 'сүрөгдөр тохируу' that don't form coherent meaning. Does not explain what Monte Carlo simulation is or when it's used. Complete failure on all metrics."
23,neutral_technical,claude_opus_4.5,2,2,2,6,16.61,137,"Excellent technical explanation with correct photosynthesis equation, clear structure covering light/dark reactions, ATP/NADPH, chlorophyll, Calvin cycle. Natural Mongolian with proper scientific terminology. Thorough and well-organized with table and formatting."
23,neutral_technical,gpt_5.2,2,2,2,6,20.38,313,"Excellent technical explanation in Mongolian covering both light-dependent and light-independent reactions, ATP/NADPH production, electron transport chain, and Calvin cycle. Uses correct scientific terminology and provides clear structure with numbered sections. Matches the level of detail in the reference answer."
23,neutral_technical,gemini_3_pro,2,2,1,5,21.31,139,"Factually accurate, explains light absorption, light reactions, water splitting, O2 release, and Calvin cycle. Fluent native Mongolian. Cut off mid-word ('глю' instead of 'глюкоз'), missing full depth on ATP/NADPH and final equation, thus Completeness=1."
23,neutral_technical,grok_4.1,2,2,2,6,13.73,300,"Excellent technical explanation in natural Mongolian. Covers light-dependent/independent reactions, chemical equations, ATP/NADPH, Calvin cycle, chlorophyll function—all key concepts from the reference answer. Well-structured with clear headings and examples. Fluent scientific terminology throughout."
23,neutral_technical,deepseek_v3.2,2,2,2,6,14.1,95,"Excellent technical answer covering photosynthesis mechanism: chloroplasts, chlorophyll photon absorption, water splitting to O2, ATP/NADPH energy carriers, and Calvin cycle CO2 fixation to glucose. Accurate, fluent Mongolian with proper scientific terminology, and thorough coverage of the process."
23,neutral_technical,llama_4_maverick,2,2,2,6,1.91,179,"Excellent response. Covers light absorption by chlorophyll, photolysis, ATP/NADPH production, Calvin cycle, and CO2→glucose conversion. Includes ecological significance (O2 production, food chain). Accurate, well-structured, natural Mongolian, and thorough."
23,neutral_technical,qwen3,2,2,2,6,12.6,246,"Excellent technical explanation with correct chemistry, clear structure, proper Mongolian terminology, and thorough coverage of light/dark reactions plus energy conversion mechanism."
23,neutral_technical,aya_expanse,0,0,0,0,16.29,146,"Complete gibberish. Text is in Mongolian script but consists of repetitive nonsense phrases like 'эргээсэн эргээсэн' (repeated spinning/turning) with no coherent scientific explanation of photosynthesis. Fabricated/hallucinatory output with no factual content about chlorophyll, light reactions, Calvin cycle, glucose, or oxygen production."
24,neutral_technical,claude_opus_4.5,2,2,2,6,27.95,270,"Excellent technical answer with correct terminology, detailed coverage of HTLCs/commitment transactions/breach remedies/onion routing/multisig, well-structured with diagrams and tables, natural Mongolian phrasing throughout"
24,neutral_technical,gpt_5.2,2,2,2,6,29.19,424,"Excellent technical answer covering all key primitives: multisig, timelocks (CLTV/CSV), HTLCs, revocation/penalty mechanisms, ECDSA/Schnorr, onion routing (Sphinx/ECDH), and watchtowers. Well-structured with clear explanations. Natural Mongolian technical prose with proper terminology. Fully addresses the question with depth."
24,neutral_technical,gemini_3_pro,2,2,1,5,36.87,167,"Correct core concepts (multisig, HTLC with hashlock/timelock), natural Mongolian, but response cut off mid-sentence—missing penalty transactions, onion routing, revocable channels. Partial coverage."
24,neutral_technical,grok_4.1,2,2,2,6,13.54,322,"Excellent technical response with correct terminology. Covers core primitives (ECDSA/Schnorr signatures, SHA-256/RIPEMD-160 hashes, CLTV/CSV timelocks, HTLCs, revocation secrets, multisig) plus advanced concepts (Watchtowers, Taproot/Schnorr, MuSig2). Accurate, naturally fluent Mongolian with proper technical vocabulary, and thoroughly addresses all aspects of LN security primitives."
24,neutral_technical,deepseek_v3.2,2,2,2,6,10.16,94,"Excellent technical response covering HTLCs, multi-sig, watchtowers, onion routing. Matches reference answer's core primitives. Natural Mongolian with proper terminology."
24,neutral_technical,llama_4_maverick,2,2,2,6,1.14,109,"Excellent response. Correctly identifies HTLCs, multi-sig, onion routing, and digital signatures. Fluent native-level Mongolian with proper technical terminology. Thorough explanation covering all major security primitives."
24,neutral_technical,qwen3,2,2,2,6,22.64,375,"Excellent technical response with correct crypto primitives (HTLC, timelock, RSMC, signatures). Fluency is native-quality Mongolian with proper terminology. Thorough coverage exceeds basic requirement. No Kyrgyz markers detected."
24,neutral_technical,aya_expanse,0,0,0,0,16.79,133,"Completely garbled text with nonsensical repetition. No recognizable Mongolian words or meaningful content. Appears to be corrupted output or model failure. Does not address HTLCs, penalty transactions, onion routing, or any actual Lightning Network security primitives."
25,neutral_technical,claude_opus_4.5,1,2,2,5,40.69,510,"Very thorough technical explanation with tables, equations, tools, and practical checklists. However, the reference answer is simpler ('avoiding parallel routing, spacing traces, decoupling caps'), so this is partially correct but far more expansive. Content is accurate PCB design practice. Fluency is excellent—native Mongolian with technical terminology. Completeness is full."
25,neutral_technical,gpt_5.2,0,2,0,2,46.39,738,"Wrong language: response in Mongolian script but question asks for PCB signal integrity tools. Reference answer is 'avoiding parallel routing, spacing traces, decoupling caps'—a simple, brief answer. Model gave extremely detailed PCB design guide (stack-up, impedance control, via design, termination, simulation tools, measurement equipment) totaling ~1500 words. While technically accurate for PCB SI in general, it's a complete mismatch: question asks for brief practical advice, answer is exhaustive engineering tutorial. Fluency=2 (native Mongolian), Accuracy=0 (massively over-engineered, wrong scope), Completeness=0 (answers different question)."
25,neutral_technical,gemini_3_pro,2,2,2,6,22.54,261,"Excellent technical answer in proper Mongolian. Goes far beyond the reference answer with comprehensive coverage of signal integrity principles (impedance control, stack-up, differential pairs, crosstalk, vias, power integrity) and mentions appropriate tools (EDA/simulation software). Answer appears cut off but what's present is thorough and accurate."
25,neutral_technical,grok_4.1,1,2,2,5,15.69,381,"Excellent Mongolian fluency and extremely thorough (way beyond expected scope). However, the reference answer is specifically about trace spacing and decoupling caps placement. This response covers those plus impedance control, via design, stackup, etc. - comprehensive but arguably over-answers. The core concepts are correct but the reference is simpler/more focused. Accuracy=1 for partial match (has the right ideas but not as concise as reference). Fluency=2 (perfect Mongolian). Completeness=2 (addresses question fully, even excessively)."
25,neutral_technical,deepseek_v3.2,1,2,1,4,80.19,148,"Response is fluent in Mongolian with proper technical vocabulary. However, it misses the key ground-truth answer (avoiding parallel routing, spacing traces, decoupling caps). Instead gives general PCB design practices (impedance matching, ground planes, length matching) and extensive tool lists (CAD software, oscilloscopes, analyzers) which are relevant but not what was asked. Partially correct but incomplete match to reference answer."
25,neutral_technical,llama_4_maverick,1,2,1,4,2.27,258,"Fluent Mongolian but overexplains with CAD/simulation tools instead of core PCB layout techniques (parallel routing avoidance, trace spacing, decoupling). Mentions key concepts (layer organization, trace routing, decoupling caps, grounding) but misses the concise practical focus of reference answer."
25,neutral_technical,qwen3,1,2,2,5,22.24,443,"Fluent Mongolian, thorough coverage of SI topics (impedance, ground planes, crosstalk, decoupling, simulation tools). However, the English reference is very specific: 'avoid parallel routing, spacing out traces, decoupling caps.' The response covers those points but adds extensive material (differential pairs, via design, power integrity, etc.) not in the reference. Core answer is present but less concise. Accuracy = 1 (partially correct, key ideas present but not matching terse reference style); Fluency = 2 (natural Mongolian); Completeness = 2 (fully addresses the question with depth)."
25,neutral_technical,aya_expanse,0,0,0,0,21.53,200,"Response is nonsensical repetitive text with no actual technical content. Uses made-up/garbled words like 'хоёрчлонго', 'тогтмолго' that don't exist in Mongolian. Completely fails to address PCB signal integrity (parallel routing, trace spacing, decoupling caps). Appears to be a model hallucination or generation error."
