question_id,category,model,accuracy,fluency,completeness,total,response_time,response_length,notes
1,neutral_factual,claude_opus_4.5,2,2,2,6,19.2,122,"Excellent response. Accurately identifies cement failure and BOP malfunction as direct causes. Goes beyond minimum with organizational structure, context, and consequences. All in natural Mongolian with proper technical terminology."
1,neutral_factual,gpt_5.2,1,2,2,5,18.86,184,"Mongolian fluency excellent. Response comprehensive with technical detail. However, accuracy = 1 because answer sheet specifies 'bad cement job AND failure of shoe track barrier' as the core cause, but model does not mention shoe track barrier failure at all—only discusses cement failure, BOP malfunction, and decision errors. Key technical detail missing."
1,neutral_factual,gemini_3_pro,2,2,2,6,20.09,201,"Excellent response. Correctly identifies cement failure and BOP (shoe track barrier) failure as key causes. Adds contextual detail (methane, pressure tests, detection delay) that enriches understanding without contradicting the reference. Language is fluent Mongolian with proper technical vocabulary. Thorough and complete."
1,neutral_factual,grok_4.1,1,2,2,5,10.22,169,"Response is fluent and thorough with extensive detail, but contains factual inaccuracies: mentions 11 deaths (correct) and $65B settlement (actual total was ~$20-21B). Core technical cause (cement job failure, BOP failure) is present but buried in lengthy narrative. Partially correct overall."
1,neutral_factual,deepseek_v3.2,1,2,1,4,10.05,108,"Partially correct: mentions bad cement and BOP failure (correct elements) but adds unnecessary details (pressure test errors, management issues, death toll, barrel count) not in reference answer. Fluent Mongolian. Addresses question but exceeds scope with consequences."
1,neutral_factual,llama_4_maverick,1,2,1,4,0.93,66,"Factually correct on date, explosion, and scale, but omits the technical cause (cement failure, shoe track barrier). Fluent Mongolian with proper grammar and vocabulary."
1,neutral_factual,qwen3,2,2,2,6,24.86,284,"Excellent response. Accurately identifies cement failure and barrier issues as primary causes. Exceeds reference by providing comprehensive technical details, timeline, consequences, and regulatory context. Fluent Mongolian with proper technical terminology. Fully addresses the question with extensive detail."
1,neutral_factual,aya_expanse,0,0,0,0,14.76,144,"Wrong language (appears to be Kyrgyz or heavily corrupted text, not Mongolian). Contains Kyrgyz markers like 'өлтүрүлгөн', 'анын', 'жана', lacks Mongolian Cyrillic structure. Content is also factually wrong: focuses on explosion/deaths rather than technical cement/barrier failure. Triple fail."
2,neutral_factual,claude_opus_4.5,2,2,2,6,19.27,126,"Excellent response. Accurate facts (dates, title 'El Libertador', six countries including Panama, Gran Colombia vision). Natural Mongolian with proper formatting. Goes beyond minimum requirements with structured explanation of his vision and legacy. All key points covered."
2,neutral_factual,gpt_5.2,2,2,2,6,21.74,300,"Excellent response. Factually accurate, covers all key points (El Libertador, six countries freed, dates, military/political role), provides additional valuable context about Gran Colombia and his legacy. Natural Mongolian with proper terminology. Far exceeds the brief English reference answer in depth while remaining accurate."
2,neutral_factual,gemini_3_pro,2,2,2,6,19.87,201,"Excellent response. Factually accurate, covers all key points from reference answer plus substantial additional detail (6 countries named, Gran Colombia, Bolivia named after him, ideological influences). Natural Mongolian throughout, no language errors. Thorough and well-structured."
2,neutral_factual,grok_4.1,2,2,2,6,14.25,267,"Excellent response with comprehensive biographical details, major battles, political vision, and lasting legacy. Significantly exceeds the reference answer in depth while maintaining full accuracy. Natural Mongolian fluency throughout."
2,neutral_factual,deepseek_v3.2,2,2,2,6,12.0,129,"Excellent response. Factually accurate with correct dates, title 'El Libertador', six countries freed. Goes beyond reference with campaign details, constitutional work, Gran Colombia vision. One minor oddity: 'Өмнөд Америкийн эрх чөлөөний авьяаслаг хөгжимч' (talented musician of South American freedom) appears to be a mistranslation but context shows intent was 'liberator'. Fluent Mongolian throughout. Very thorough."
2,neutral_factual,llama_4_maverick,2,2,2,6,1.38,100,"Excellent response. Factually accurate, covers all key points (Venezuelan leader, freed ~6 countries from Spain, 'El Libertador' implied by role description), fluent native Mongolian, thorough with cultural context (comparison to Washington). Minor: doesn't explicitly say 'El Libertador' title but clearly conveys the liberator role."
2,neutral_factual,qwen3,2,2,2,6,15.57,252,"Excellent response. Factually accurate, covers all key points (El Libertador, freed 6 countries, Gran Colombia vision, Bolivia named after him). Fluent native Mongolian. Goes beyond minimal answer with well-structured detail on his political/military role, pan-Latin American vision, and legacy. Full marks."
2,neutral_factual,aya_expanse,1,0,1,2,14.45,137,"Text is severely garbled/machine-translated with nonsensical phrases ('багдаг', 'баярлалтын туслаа', 'өрөөлтнөн гана'). Contains some factual elements (dates 1783-1830, liberation, countries) but buried in gibberish. Not fluent Mongolian. Repetitive broken text."
3,neutral_factual,claude_opus_4.5,2,2,2,6,17.93,141,"Excellent response. Provides all key facts: 34% salinity (~10x ocean = 9.6x in reference), density enables floating, explains Dead Sea location/nature, adds relevant cultural context about lowest point on Earth, therapeutic uses, environmental concerns. All in natural Mongolian with proper formatting."
3,neutral_factual,gpt_5.2,1,2,1,4,15.88,197,"Correct language. Accurate broad info (hypersaline, floating, minerals, evaporation issues) but missing key numeric specs from reference: 342 g/kg salinity, 9.6x ocean, 1.24 kg/L density. Verbose context but lacks precision. Partial accuracy, partial completeness."
3,neutral_factual,gemini_3_pro,2,2,2,6,56.04,255,"Excellent response. Factually accurate (34% salinity ≈ 342 g/kg, ~10x ocean = 9.6x, density enables floating). Natural fluent Mongolian with proper script. Goes beyond minimum with geographic location, lowest point on earth, no outlet explanation, therapeutic properties, environmental concerns. Far exceeds basic answer requirements."
3,neutral_factual,grok_4.1,2,2,2,6,9.02,160,"Correct salinity (34%, ~10x ocean), density allowing floating, all key facts present. Adds relevant cultural/historical context. Natural Mongolian with proper terminology."
3,neutral_factual,deepseek_v3.2,0,2,0,2,13.64,113,Completely wrong content: describes 'dead zones' (hypoxic ocean areas) instead of the Dead Sea (high-salinity lake). Fluent Mongolian but factually incorrect.
3,neutral_factual,llama_4_maverick,2,2,2,6,2.16,113,"Excellent response. Covers salinity (~33.7% vs ref 34.2%), density/floating, lowest point on Earth, unique biology, therapeutic properties. Accurate, fluent Mongolian, thorough."
3,neutral_factual,qwen3,2,2,2,6,80.3,253,"Excellent response. All key facts correct: salinity ~34% (answer sheet says 34.2%), 9.6-10x saltier than ocean, density enables floating, Dead Sea name due to no life. Added rich context (lowest elevation, location, therapeutic properties, biblical history) without errors. Natural Mongolian throughout."
3,neutral_factual,aya_expanse,0,0,0,0,5.64,59,"Response is completely off-topic - appears to be random poetic verse with no factual content about the Dead Sea. Does not address salinity, density, or floating properties at all. Completely fails to answer the question."
4,neutral_factual,claude_opus_4.5,2,2,2,6,14.87,107,"Correct answer (10) with excellent additional context about street version, racing homologation, engine specs, and cultural reference. Natural Mongolian with proper technical terms."
4,neutral_factual,gpt_5.2,1,2,1,4,5.94,75,Correct number (10) given but hedged with 'approximately' and extra race-version details not asked for. Fluency is natural Mongolian. Completeness partial due to unnecessary elaboration and question back to user.
4,neutral_factual,gemini_3_pro,1,2,2,5,16.69,104,"Answer is 6 instead of correct 10. Fluent Mongolian with good detail, but factually incorrect on the core number."
4,neutral_factual,grok_4.1,2,2,2,6,7.28,53,"Correct answer (10) with excellent additional context about DTM homologation, color, and exclusivity. Natural Mongolian phrasing."
4,neutral_factual,deepseek_v3.2,1,2,1,4,15.27,159,"Model says 6-10 units, correct answer is 10. Provides correct number in range but adds uncertainty and alternate figure (6). Fluency is native-level Mongolian. Completeness partial: overly detailed with race vs street versions when question asks total production."
4,neutral_factual,llama_4_maverick,2,2,2,6,0.44,24,"Correct answer (10), natural Mongolian, adds relevant context about racing purpose and collector value"
4,neutral_factual,qwen3,2,2,2,6,4.01,61,"Correct answer (10), proper Mongolian with no Kazakh/Kyrgyz markers, adds relevant context about ALMS racing purpose and rarity"
4,neutral_factual,aya_expanse,0,0,0,0,46.71,377,Wrong answer (says 1000+ instead of 10). Text heavily corrupted with endless repetition of meaningless phrases. Completely unreadable.
5,neutral_factual,claude_opus_4.5,2,2,2,6,12.61,92,"Correct height, correct year, excellent Mongolian fluency, thorough explanation with history and tragedy details"
5,neutral_factual,gpt_5.2,2,2,2,6,4.22,43,"Correct answer (109 ft/~33m), natural Mongolian, provides extra context about 1990s and offers further detail"
5,neutral_factual,gemini_3_pro,2,2,2,6,272.61,43,"Correct height (109'10""/~33m), adds historically accurate context about 1969 and safety restrictions. Natural Mongolian, fully addresses question."
5,neutral_factual,grok_4.1,0,2,0,2,19.57,128,"Completely wrong answer. Question asks about Texas A&M Aggie Bonfire (109'10""/33m), model answered about Mongolian yurt fire poles (~25m). Fluent Mongolian but factually fabricated."
5,neutral_factual,deepseek_v3.2,0,2,0,2,7.1,49,"Model refused to answer, claiming no reliable information. Correct answer is 109'10"" (Aggie Bonfire at Texas A&M). Response is fluent Mongolian but factually incorrect refusal."
5,neutral_factual,llama_4_maverick,0,2,0,2,0.78,58,"Model misunderstands 'Aggie Bonfire' (Texas A&M tradition), confuses it with generic bonfires, gives wrong info (Dubai 60m), wrong answer (correct: 109'10""/33m). Fluent Mongolian but factually incorrect."
5,neutral_factual,qwen3,0,2,0,2,15.67,212,"Model completely misunderstands question. Correct answer is 109'10"" (~33m) for Texas A&M Aggie Bonfire. Model instead discusses Hindu fire deity Agni, stupas, pagodas. Wrong topic entirely. Fluent Mongolian but factually incorrect."
5,neutral_factual,aya_expanse,0,0,0,0,46.5,414,"Wrong answer (45 vs 109'10""/~33m). Response degenerates into nonsensical repetitive text, indicating severe generation failure. Completely broken output."
6,neutral_factual,claude_opus_4.5,2,2,2,6,14.74,112,"Correct (Indonesian and Belgian heritage), natural Mongolian, thorough with cultural details"
6,neutral_factual,gpt_5.2,1,2,1,4,10.36,137,Partially correct: mentions Indonesian and Belgian heritage but adds excessive speculation about Batak ethnicity and cultural traditions not in reference answer. Fluency is natural Mongolian. Completeness partial: answers the core question but overcomplicates with unnecessary detail.
6,neutral_factual,gemini_3_pro,2,2,2,6,13.02,111,"Correct factual content (Indonesian and Belgian heritage), natural Mongolian, thorough explanation with cultural details about Batak ethnicity and family background."
6,neutral_factual,grok_4.1,2,2,2,6,13.84,114,"Correct: Indonesian and Belgian heritage. Fluent Mongolian with proper cultural/ethnic detail (Minangkabau, Maluku). Goes beyond reference with rich context but remains accurate."
6,neutral_factual,deepseek_v3.2,0,2,0,2,6.75,58,"Model refuses to answer, claims lack of knowledge. Radja Nainggolan is a Belgian footballer of Indonesian heritage—this is answerable factual knowledge. Fluency is native-level Mongolian but content scores 0/0."
6,neutral_factual,llama_4_maverick,0,2,0,2,1.04,71,"Complete hallucination. Radja Nainggolan is a Belgian-Indonesian footballer, not a region in Sumatra. Model fabricated geographic/cultural details. Fluency is native-level Mongolian but content is entirely wrong."
6,neutral_factual,qwen3,1,2,1,4,12.2,233,"Correct heritage (Indonesian/Belgian) eventually mentioned but buried in verbose, rambling response. Treats question as if unclear, then correctly identifies Radja Nainggolan the footballer with Belgian and Indonesian (Bali) heritage. Fluent Mongolian but lacks conciseness. Partially complete due to excessive speculation before giving the answer."
6,neutral_factual,aya_expanse,0,0,0,0,10.35,108,"Response is in Kyrgyz, not Mongolian. Uses 'жана' (Kyrgyz 'and') instead of Mongolian 'ба', 'өлкөнүн', 'анкаттын', 'болоорунан' are Kyrgyz forms. Content is also incoherent football rambling unrelated to Nainggolan's Indonesian-Belgian heritage."
7,neutral_factual,claude_opus_4.5,2,2,2,6,13.0,92,"Perfect answer with excellent additional context about Vermont Republic 1777-1791, mentions Texas and Hawaii correctly as later examples, fluent Mongolian"
7,neutral_factual,gpt_5.2,2,2,2,6,4.94,53,"Correct answer (Vermont) with historically accurate detail about Vermont Republic 1777-1791. Natural Mongolian fluency, thorough explanation."
7,neutral_factual,gemini_3_pro,2,2,2,6,10.36,44,Perfect answer with bonus historical detail about Vermont Republic (1777-1791) and statehood date. Fully fluent Mongolian.
7,neutral_factual,grok_4.1,2,2,2,6,72.72,66,"Excellent response. Correct answer (Vermont) with extensive accurate detail: dates 1777-1791, proper name 'Republic of Vermont', mentioned constitution/army/currency/diplomacy, correct admission date 1791 as 14th state. Also correctly noted Texas was independent later (1836-1845). Fluent Mongolian with no errors."
7,neutral_factual,deepseek_v3.2,2,2,2,6,136.0,80,"Correct answer (Vermont), natural Mongolian, thorough with historical details and dates"
7,neutral_factual,llama_4_maverick,1,2,1,4,1.45,137,Partially correct. Response correctly mentions Vermont 1777-1791 as independent but incorrectly claims no US state was independent in late 1700s. Hawaii (1795-1893) and Rhode Island discussion add unnecessary confusion. Vermont IS the correct answer.
7,neutral_factual,qwen3,0,2,1,3,4.3,83,"Factually incorrect. Vermont was independent 1777-1791. Model refused to give Vermont, instead explained 13 colonies' independence from Britain. Fluent Mongolian but wrong answer."
7,neutral_factual,aya_expanse,0,0,0,0,8.2,77,"Response is incomprehensible garbled text, does not answer question (Vermont), wrong language (appears broken Mongolian), completely off-topic mentioning China/Japan/Korea/India instead of US state"
8,neutral_factual,claude_opus_4.5,1,2,1,4,14.7,116,Partially correct numbers: 150-200k horses vs correct 187.6k; 25-30k returned vs correct 1.6k. Fluent Mongolian with proper script and natural phrasing. Provides context but significantly overstates horses returned (off by factor of ~15-20x).
8,neutral_factual,gpt_5.2,1,2,1,4,10.96,101,"Factually incorrect numbers: gives 200k-250k horses taken vs ground truth 187,600, and 'almost none' vs ground truth 1,600. Fluent Mongolian. Partial completeness as it addresses the question but with wrong figures."
8,neutral_factual,gemini_3_pro,1,2,2,5,48.66,173,"Factually incorrect numbers: says 180,000-200,000 went and almost none returned. Correct answer is 187,600 went and 1,600 returned. Model gives correct general narrative (massive horse losses) but wrong specific figures. Fluent Mongolian. Thorough explanation."
8,neutral_factual,grok_4.1,1,2,1,4,11.7,103,"Model gives ~200k horses taken vs. correct 187,600, and 1,000-2,000 returned vs. correct 1,600. Close but not exact numbers. Fluent Mongolian. Partial completeness with extra context but imprecise core facts."
8,neutral_factual,deepseek_v3.2,1,2,1,4,9.85,84,"Partially correct: mentions ~200,000 horses taken (close to 187,600) and 'a few thousand' returned (vs. 1,600). Lacks specific numbers. Fluent Mongolian. Addresses question but misses precision."
8,neutral_factual,llama_4_maverick,1,2,2,5,0.74,37,"Close numbers (200k vs 187.6k initial, 1k vs 1.6k returned) but not exact. Fluency perfect Mongolian. Thorough with context."
8,neutral_factual,qwen3,0,2,2,4,9.64,135,"Fluent Mongolian with thorough explanation, but completely wrong numbers. Reference answer: 187,600 horses taken, 1,600 returned. Response gives 300,000-400,000 taken and various ranges (5,000-30,000) for returned—all incorrect."
8,neutral_factual,aya_expanse,0,0,0,0,8.82,96,"Completely garbled output. Text is unreadable nonsense with random words repeated. Does not provide the factual answer (187,600 horses taken, 1,600 returned). Wrong language/broken generation."
9,neutral_factual,claude_opus_4.5,2,2,2,6,13.35,109,"Correct answer (J1407b/V1400 Centauri), natural Mongolian, thorough with extra context. Addresses 640x claim explicitly."
9,neutral_factual,gpt_5.2,2,2,2,6,9.23,84,"Correct answer (J1407b/J1047B orbiting V1400 Centauri/J1407). Model provides the right planet, star, and constellation. Fluent Mongolian. Extra detail about it being a candidate and not directly imaged is accurate bonus info."
9,neutral_factual,gemini_3_pro,2,2,2,6,36.27,36,Fully correct. J1407b orbiting V1400 Centauri (also J1407). Mentions 'Super Saturn' nickname and brown dwarf possibility. Natural Mongolian phrasing.
9,neutral_factual,grok_4.1,2,2,2,6,6.37,69,"Excellent response. Correctly identifies J1407b (J1047B variant) orbiting V1400 Centauri with accurate 640x size comparison. Provides extra context about discovery date and ring system composition, all in fluent natural Mongolian."
9,neutral_factual,deepseek_v3.2,0,2,0,2,264.83,76,"Model refuses to answer and provides incorrect information. The correct answer (J1047B orbiting V1400 Centauri) is a known exoplanet system, but model claims no such planet is known. Fluent Mongolian."
9,neutral_factual,llama_4_maverick,1,2,2,5,0.83,47,Model gives J1407b/J1407 instead of correct J1047B/V1400 Centauri. Similar naming but wrong designation = partial credit. Response is fluent Mongolian with good detail.
9,neutral_factual,qwen3,0,2,1,3,12.72,251,"Model denies correct answer exists, claims J1407 is closest match but wrongly states no 640x system known. Correct answer is J1047B/V1400 Centauri. Fluent Mongolian but factually incorrect."
9,neutral_factual,aya_expanse,0,0,0,0,9.23,120,"Completely incoherent response. Mixes computer science terms (bits, bytes) into astronomy question. No mention of J1047B or V1400 Centauri. Text is garbled and unreadable, possibly machine translation error or hallucination."
10,neutral_factual,claude_opus_4.5,0,2,1,3,16.6,166,"Completely wrong date and event. Answer sheet says either Oct 30, 1929 (+12%, Rockefeller statement) or April 9, 2025 (+9.5%, Trump tariff pause). Model gives March 15, 1933 (+15.34%, FDR bank holiday end). Fluency perfect, structure thorough, but factually incorrect."
10,neutral_factual,gpt_5.2,0,2,0,2,18.25,243,"Model provides wrong answer (March 15, 1933, +15.34%, Great Depression context). Correct answer is April 9, 2025, +9.5%, Trump tariff pause. Fluent Mongolian but factually incorrect."
10,neutral_factual,gemini_3_pro,1,2,1,4,22.08,119,"Wrong date/answer: gives Oct 30, 1929 instead of April 9, 2025. The answer sheet accepts EITHER date as correct for Q10, but the English ref for C4 explicitly says April 9, 2025 (+9.5%, Trump tariff pause). Model gives Oct 1929 (+12.34%, Black Tuesday recovery/Rockefeller). Since instructions say 'accept either' for Q10, accuracy=1 (partial). Fluency=2 (natural Mongolian). Completeness=1 (addresses question but wrong answer). Response also cuts off mid-sentence ('Хөр')."
10,neutral_factual,grok_4.1,0,2,2,4,16.2,186,"Wrong date: model gives Oct 30, 1929 (+12.34%) instead of April 9, 2025 (+9.5%, Trump tariff pause). English answer sheet allows Oct 30, 1929 OR April 9, 2025, but Mongolian reference clearly shows April 9, 2025 as correct. Model provides detailed explanation but for wrong event. Fluency excellent, completeness thorough for wrong answer."
10,neutral_factual,deepseek_v3.2,0,2,0,2,265.33,101,"Model refused to answer, provides generic market info instead. Should have stated April 9, 2025 / 9.5% / Trump tariff pause. Fluency is native Mongolian."
10,neutral_factual,llama_4_maverick,0,2,1,3,2.07,203,"Answer is factually incorrect. Reference answer is April 9, 2025 (+9.5%, Trump tariff pause). Model gives Oct 30, 1929 (+12.34%) and March 24, 2020 (+11.4%). Though fluent Mongolian, the answer is wrong and outdated (pre-2025). Partial completeness for discussing historical context but missing the actual correct date."
10,neutral_factual,qwen3,0,2,2,4,13.43,243,"Wrong date and event. Model claims April 6, 2020 (COVID recovery rally, +7.73%) but correct answer is April 9, 2025 (Trump tariff pause, +9.5%) OR October 30, 1929 (Rockefeller statement, +12%). Fluency excellent, completeness thorough, but factually incorrect."
10,neutral_factual,aya_expanse,0,0,0,0,46.09,263,Complete gibberish with severe text corruption. Unreadable repetitive nonsense ('сүрөгчдийн' repeated hundreds of times). Cannot extract any meaningful content. Total system failure.
11,neutral_reasoning,claude_opus_4.5,0,2,1,3,12.5,93,"Wrong answer. The logic is you need to drive because you're taking the car to be washed. Response suggests walking, which misses the trick. Fluency is excellent Mongolian. Partial completeness for addressing the question structure."
11,neutral_reasoning,gpt_5.2,0,2,2,4,7.9,90,"Wrong answer. Ground truth: drive there because you are washing the car (need car at car wash). Model says walk (50m is close). Fluent Mongolian, thorough reasoning, but fails the logic trick."
11,neutral_reasoning,gemini_3_pro,2,2,2,6,10.31,26,"Perfect response. Correct logic (drive because you're washing the car), natural Mongolian fluency, thorough explanation with practical reasoning added."
11,neutral_reasoning,grok_4.1,0,2,1,3,11.38,28,"Wrong answer. Logic puzzle: must drive because you're washing the car itself. Model suggests walking there, then bringing car later—misses the point entirely. Fluent Mongolian though."
11,neutral_reasoning,deepseek_v3.2,0,2,2,4,138.35,66,"Completely missed the logic trick: you need to drive because you're washing the car. Fluent Mongolian, thorough reasoning about distance, but wrong conclusion."
11,neutral_reasoning,llama_4_maverick,0,2,2,4,0.83,42,"Wrong answer. Logic puzzle requires driving because you need the car at the wash. Model explains walking benefits instead. Fluent Mongolian, thorough but incorrect."
11,neutral_reasoning,qwen3,0,2,2,4,4.92,93,"Wrong answer. Model recommends walking, but the correct logic is to drive because you need the car AT the car wash to wash it. Fluency and structure are excellent, but misses the trick question entirely."
11,neutral_reasoning,aya_expanse,0,0,0,0,11.08,117,Response is completely garbled/broken Mongolian with repetitive nonsensical phrases. Does not answer the logic puzzle (should drive to wash the car). Fluency=0 for unreadable broken text.
12,neutral_reasoning,claude_opus_4.5,2,2,2,6,5.34,61,"Correct calculation (11.2 = 11.20), clear reasoning with breakdown, fluent Mongolian with proper formatting"
12,neutral_reasoning,gpt_5.2,2,2,2,6,2.58,38,"Correct final answer ($11.20), correct reasoning with clear math steps, natural Mongolian, fully addresses the question."
12,neutral_reasoning,gemini_3_pro,2,2,2,6,14.96,46,Perfect answer with correct calculation and clear step-by-step explanation in natural Mongolian
12,neutral_reasoning,grok_4.1,2,2,2,6,3.09,46,Perfect answer with clear step-by-step reasoning in natural Mongolian. Correct final answer $11.2.
12,neutral_reasoning,deepseek_v3.2,2,2,2,6,5.24,48,Perfect answer with correct calculation and clear explanation in natural Mongolian.
12,neutral_reasoning,llama_4_maverick,2,2,2,6,0.53,40,"Correct calculation, clear reasoning, natural Mongolian"
12,neutral_reasoning,qwen3,2,2,2,6,4.31,84,"Correct answer (11.2 = $11.20), clear step-by-step reasoning, fluent natural Mongolian"
12,neutral_reasoning,aya_expanse,0,1,0,1,8.3,99,"Response is confused and repetitive, never reaches correct answer of $11.20. Shows attempted reasoning but calculations are incoherent. Mongolian is understandable but awkward phrasing."
13,neutral_reasoning,claude_opus_4.5,2,2,2,6,7.68,92,"Perfect answer with correct logic, correct final values, presented clearly in Mongolian with proper formatting and verification"
13,neutral_reasoning,gpt_5.2,2,2,2,6,3.91,70,"Perfect answer with clear mathematical reasoning in Mongolian. Shows the algebra and arrives at the correct conclusion: two friends pay $21 each, one pays $42."
13,neutral_reasoning,gemini_3_pro,2,2,2,6,11.9,77,"Perfect reasoning with clear algebraic setup, correct calculation, and verification. Natural Mongolian mathematical language."
13,neutral_reasoning,grok_4.1,2,2,2,6,9.65,74,"Perfect answer with correct logic, correct final values, clear explanation in natural Mongolian, and verification step included."
