question_id,category,model,accuracy,fluency,completeness,total,response_time,response_length,notes
27,neutral_technical,deepseek_v3.2,2,2,2,6,79.38,117,"Excellent response. Factually accurate, covering passive transport, diffusion (any molecules), osmosis (water only, semipermeable membrane). Goes beyond reference answer with extra details (concentration gradient, no need for membrane in diffusion). Fluent Mongolian with proper technical vocabulary. Thorough and well-structured."
27,neutral_technical,llama_4_maverick,2,2,2,6,3.38,144,"Excellent response. Accurate explanation of both concepts, correctly distinguishes them (diffusion for any molecules vs osmosis specifically for water through semipermeable membrane). Fluent native Mongolian. Thorough with good detail including concentration gradients, kinetic energy, and biological relevance. Covers all key points from reference answer plus adds helpful context."
27,neutral_technical,qwen3,1,2,1,4,21.23,96,"Content is correct and fluent in Mongolian. However, missing key biological application: doesn't mention passive transport, cell turgidity, or plant water uptake (critical points in reference). Focuses on mechanism over biological importance."
27,neutral_technical,aya_expanse,0,0,0,0,10.14,44,Response is completely garbled/unintelligible. Contains nonsensical repetitive phrases like 'жагсаалтанд харилцан байгаа аялалд хоорч уруулж буйгаас' that have no biological meaning. Appears to be machine translation failure or text corruption. No actual explanation of diffusion vs osmosis provided.
28,neutral_technical,claude_opus_4.5,0,2,0,2,18.96,106,"Response answers which companies are SUITABLE for LBOs (stable cash flow, asset-rich, low debt), not which companies MOST LIKELY ENACT debt buybacks (over-levered PE-owned firms). Completely wrong focus despite fluent Mongolian."
28,neutral_technical,gpt_5.2,0,2,0,2,20.29,153,"Model answered a completely different question about what types of companies can buy debt portfolios, not which companies enact debt buybacks. Natural Mongolian but wrong topic."
28,neutral_technical,gemini_3_pro,0,0,0,0,24.61,4,"Pipeline broken: output is incomplete garbled fragment '**Алхам 2: Англи х', not a real answer. Refuse/error=0/0/0"
28,neutral_technical,grok_4.1,0,2,1,3,15.99,112,Complete misinterpretation: answered about debt collection agencies instead of debt buybacks by over-levered companies. Fluent Mongolian but factually wrong topic.
28,neutral_technical,deepseek_v3.2,0,2,1,3,146.75,73,"Response discusses debt collection/purchasing agencies buying consumer debt portfolios, completely missing the correct answer about over-levered companies doing debt buy-backs. Fluent Mongolian but factually incorrect content."
28,neutral_technical,llama_4_maverick,0,2,1,3,1.34,53,"Fluent Mongolian but completely wrong content. Model describes strong, stable companies suitable for LBO targets, whereas the correct answer is over-levered distressed companies doing debt buybacks. Opposite scenario."
28,neutral_technical,qwen3,1,2,1,4,10.21,93,"Partially correct. Mentions PE firms and LBOs accurately, but misses the critical point about over-levered companies facing interest payment difficulties with excess cash (the actual answer). Focuses on PE firms as acquirers rather than over-levered companies as the ones doing debt buybacks. Fluency is excellent, natural Mongolian. Completeness is partial as it addresses LBOs generally but not the specific scenario of debt buybacks by distressed companies."
28,neutral_technical,aya_expanse,0,0,0,0,48.14,299,"Complete gibberish - repetitive nonsensical phrases about clothes, money, documentation, market relations. Appears to be a catastrophic model failure/hallucination. Does not address debt buybacks at all."
29,neutral_technical,claude_opus_4.5,2,2,2,6,16.71,68,"Correct answer 'элерон' (aileron) clearly stated. Response provides thorough explanation of function, location, and operation in fluent Mongolian. Excellent technical detail and natural phrasing."
29,neutral_technical,gpt_5.2,2,2,2,6,6.97,55,Correct term 'эйлерон' with thorough explanation of roll motion and opposite deflection mechanism. Natural Mongolian fluency.
29,neutral_technical,gemini_3_pro,2,2,2,6,17.74,53,"Perfect response. Correctly identifies ailerons (элерон) with accurate technical description of their function and location. Natural Mongolian phrasing, properly explains counter-movement mechanism. Fully addresses the question with appropriate detail."
29,neutral_technical,grok_4.1,2,2,2,6,11.68,67,Correct answer (Aileron) with excellent technical explanation in fluent Mongolian. Fully addresses the question with appropriate detail about function and mechanism.
29,neutral_technical,deepseek_v3.2,2,2,2,6,74.95,100,Perfect answer. Model correctly identified 'aileron' and provided thorough explanation in natural Mongolian. Pipeline steps shown but final Mongolian answer is complete and accurate.
29,neutral_technical,llama_4_maverick,2,2,2,6,1.55,49,"Correct term 'аилэрон' given. Natural Mongolian with detailed explanation. Thorough coverage of what ailerons are, their location, and function."
29,neutral_technical,qwen3,2,2,2,6,4.98,51,Correct answer (aileron/эйлерон) given with accurate explanation of function and operation. Natural Mongolian fluency. Thorough response.
29,neutral_technical,aya_expanse,0,0,0,0,17.52,27,"Complete garbled nonsense. Contains 'цэбэрлэх' (cleaning), unrelated terms, no mention of 'aileron'. Wrong language structure, unintelligible. 0/0/0."
30,neutral_technical,claude_opus_4.5,1,2,1,4,22.44,65,"Partially correct: mentions base current controlling collector current and provides beta relationship (I_C = β × I_B) which is accurate, but misses the core mechanism: forward-biasing the Base-Emitter junction with positive voltage to allow electron flow from Emitter (N) to Collector (N). Includes a helpful diagram and Kirchhoff relation (I_E = I_C + I_B). Fluency is natural Mongolian. Completeness is partial as it explains amplification but omits the fundamental operating principle (forward-bias and electron flow)."
30,neutral_technical,gpt_5.2,2,2,2,6,22.37,216,"Excellent technical depth: covers forward/reverse bias, diffusion, recombination, beta, active/cutoff/saturation regions, exponential IC-VBE relation. Fluency is natural Mongolian with proper technical terminology. Far exceeds basic reference answer."
30,neutral_technical,gemini_3_pro,1,2,1,4,21.51,105,Response is cut off mid-sentence. Provides correct basic NPN structure and water analogy but incomplete explanation. No mention of forward-bias or Base-Emitter junction electron flow. Fluency is natural Mongolian. Partial coverage.
30,neutral_technical,grok_4.1,2,2,2,6,13.94,136,"Excellent response. Covers NPN operation (forward-bias BE, electron flow E→C), includes active/saturation/cutoff modes, quantifies β gain (100-300), explains thin base role. Correct Mongolian with proper technical terms. Far exceeds reference answer depth."
30,neutral_technical,deepseek_v3.2,2,2,2,6,156.17,103,"Excellent response. Covers NPN structure, operating conditions, detailed mechanism (forward-biased BE junction, reverse-biased BC junction, electron flow, current amplification), and operating modes. Accurate, natural Mongolian, thorough."
30,neutral_technical,llama_4_maverick,1,2,2,5,2.98,104,"Fluent Mongolian with thorough detail, but contains a conceptual error: step 3 says 'electrons flow from emitter to base,' which is misleading—majority flow is emitter→collector through base region, not primarily into base. Step 5 tries to correct this but creates confusion. Reference says electrons flow emitter→collector; this response muddies that. Partial accuracy due to error."
30,neutral_technical,qwen3,2,2,2,6,18.06,156,"Excellent response. Accurate technical explanation with proper terminology (урд чиглэлд хангадаг, бааз-эмиттер шилжилт, etc.), natural Mongolian fluency, thorough coverage including bias conditions, current amplification (β), and active region operation. Significantly exceeds the reference answer in depth."
30,neutral_technical,aya_expanse,0,0,0,0,25.3,45,"Completely garbled text with made-up/nonsense words like 'мөрөлдөөдөрөн', 'төлөрчүүдөгөр' repeated. Not Mongolian. Contains Kyrgyz-like artifacts ('жана'). Zero technical content. Total failure."
31,kazakh_cultural,claude_opus_4.5,2,2,2,6,27.47,128,"Excellent response. Factually accurate covering all major points: dombra as Kazakhstan's most representative instrument, role in kui and epic storytelling, social gatherings, aitys, symbol of national identity, UNESCO heritage, July 1st celebration. Natural Mongolian fluency throughout. Thorough and well-structured with clear sections."
31,kazakh_cultural,gpt_5.2,2,2,2,6,17.39,122,"Excellent response. Accurately covers the dombra's role in Kazakh culture: musical storytelling (küy), oral tradition support (akyns, aitys), community ceremonies, national identity symbol, and education. Fluent Mongolian with no Kazakh markers. Thorough and well-structured."
31,kazakh_cultural,gemini_3_pro,2,2,2,6,17.9,110,"Excellent response. Factually accurate covering dombra's role as national symbol, 2-string instrument, used for storytelling/epics/kui, family/community gatherings, connection to nomadic heritage. Fluent natural Mongolian. Thorough coverage of cultural significance."
31,kazakh_cultural,grok_4.1,2,2,2,6,18.03,105,"Excellent response. Covers all major aspects: musical/performance role (küy), cultural significance (celebrations, nomadic heritage), national symbol (currency, UNESCO 2014 intangible heritage), modern role (education, promotion). Factually accurate including Kurmanghazy reference and UNESCO 2014 listing. Fluency is natural Mongolian with proper terminology. Complete with sufficient cultural depth and detail."
31,kazakh_cultural,deepseek_v3.2,2,2,2,6,148.08,70,"Excellent response. Accurately describes dombra's role in Kazakh culture with key details: two-stringed instrument, national symbol, accompanies folk songs/poetry, expresses nomadic life and history, used in social gatherings/ceremonies, preserves oral tradition. Fluent Mongolian with natural phrasing. Thorough coverage of cultural significance."
31,kazakh_cultural,llama_4_maverick,2,2,2,6,1.44,209,"C5 pipeline: final Mongolian answer is accurate, natural, and thorough. Covers dombra as symbol, traditional music/storytelling, cultural heritage passed down generations, and social/cultural contexts (weddings, festivals). Matches reference answer's key points about being cornerstone of Kazakh identity, role in preserving nomadic culture, and bringing communities together. Model included all pipeline steps in response but final translation is excellent."
31,kazakh_cultural,qwen3,2,2,2,6,8.8,95,"Excellent response. Factually accurate covering dombra's role in Kazakh identity, history, oral tradition via akyns, ceremonial use. Natural Mongolian, no Kyrgyz markers. Thorough cultural detail. Matches or exceeds reference answer."
31,kazakh_cultural,aya_expanse,0,0,0,0,12.71,112,"Model answered in English then provided garbled, unreadable Mongolian translation. The Mongolian text is complete gibberish - not grammatical Mongolian, likely machine translation errors. Contains fabricated words like 'тогтмогчдын', 'көзөмбөгү', 'жашалган'. Cannot assess accuracy when text is unreadable. Fluency=0 for broken/wrong output."
32,kazakh_cultural,claude_opus_4.5,2,2,2,6,28.58,136,"Excellent response. Factually accurate on all key elements: age (~1 year), rope symbolism (black/white representing life's dualities), respected elder cutting the rope, child walking forward, optional objects to choose from. Covers symbolic significance comprehensively: freedom/independence, protection from obstacles, community blessing, life transition, cultural heritage preservation. Fluent native-level Mongolian with proper terminology. Thorough and well-structured."
32,kazakh_cultural,gpt_5.2,2,2,2,6,22.74,113,"Excellent response. Fully accurate on ceremony details (cutting fetters, blessing, family gathering, symbolic choice), captures cultural significance (milestone, blessing, community bonding, role model transmission), and written in fluent, natural Mongolian. Complete coverage of both practice and meaning."
32,kazakh_cultural,gemini_3_pro,1,2,1,4,22.2,143,"Correctly explains the ceremony (tying legs, cutting rope, choosing objects) and symbolism (freeing the child, transferring qualities, marking growth milestone). However, lacks key Kazakh-specific details from the reference: age range (1-1.5 years old), 2-3 ropes (black/white/animal intestines), parents calling child behind row of objects. Cultural depth is moderate. Fluency is native-level Mongolian."
32,kazakh_cultural,grok_4.1,1,2,1,4,24.89,148,"Response is in Mongolian as required and reads naturally. However, this is a KAZAKH cultural tradition (Tusau Kesu), and the answer misses critical Kazakh-specific details: the use of specifically black-and-white ropes (sometimes with animal intestines), the symbolic choosing of objects (book, Quran, money, dombra) to predict the child's future, and the specific cultural context. The answer provides generic information about a first-steps ceremony but lacks the depth and cultural nuance expected for a Kazakh tradition. Accuracy=1 for partial correctness, Fluency=2 for natural Mongolian, Completeness=1 for addressing the topic but missing key cultural details."
32,kazakh_cultural,deepseek_v3.2,0,2,0,2,19.16,318,Critical error: Model confused Tusau kesu (leg-tying ceremony at ~1-1.5 years) with a hair-cutting ceremony at 3-5 years. All content describes wrong tradition. Fluency perfect Mongolian. Completeness 0 as correct ceremony not addressed.
32,kazakh_cultural,llama_4_maverick,2,2,2,6,1.97,282,"Excellent response. Factually accurate with all key details: age (~1 year), symbolic cutting of rope/ribbon, transition to independence, community blessing. Fluent Mongolian with proper grammar and vocabulary. Thorough coverage of ritual mechanics and cultural significance."
32,kazakh_cultural,qwen3,1,2,1,4,9.57,101,"Content is accurate and fluent Mongolian but lacks key Kazakh-specific details: no mention of 2 ropes (black/white), age 1-1.5, the child choosing items (book/Quran/money/dombra) for future prediction. Misses cultural depth expected for full marks."
32,kazakh_cultural,aya_expanse,0,0,0,0,14.13,43,Complete nonsense. Garbled text with repeated broken phrases like 'эргээсийн сүрөгчдүйтэй холбогдлыгийг бодож буйдлуулна' that are grammatically incoherent. Does not explain Tusau Kesu ceremony (rope cutting for toddlers) at all. Appears to be severe translation corruption or hallucination.
33,kazakh_cultural,claude_opus_4.5,2,2,2,6,20.91,109,"Excellent answer with correct details on all three zhuz: location, economy, status, and major tribes. Fluent Mongolian. Comprehensive."
33,kazakh_cultural,gpt_5.2,2,2,2,6,156.78,218,"Excellent detailed answer covering geographic distribution, historical/political context, tribal composition, and social organization of the three Kazakh zhuz. Culturally nuanced and comprehensive. Natural Mongolian fluency."
33,kazakh_cultural,gemini_3_pro,2,2,2,6,19.04,153,Excellent response. Correctly identifies all three jüz with proper geographic locations and cultural/historical context. Fluent Mongolian with proper terminology. Addresses all key aspects comprehensively.
33,kazakh_cultural,grok_4.1,2,2,2,6,27.76,142,"Excellent response with accurate details on all three zhuz including locations, tribes, influences, and lifestyle patterns. The table format enhances clarity. Culturally nuanced and comprehensive."
33,kazakh_cultural,deepseek_v3.2,2,2,2,6,14.86,141,"Excellent response. Correctly identifies all three juz (Senior/Uly, Middle/Orta, Junior/Kishi), their geographic locations, explains tribal structure differences, mentions cultural/dialect variations, and historical-political roles. Fluent Mongolian with proper terminology. Fully addresses the question with good depth."
33,kazakh_cultural,llama_4_maverick,2,2,2,6,1.34,76,"Excellent response. Accurately identifies the three zhuz (Senior/Ulы, Middle/Orta, Junior/Kishi), correctly describes their geographic locations (SE, central/east, west Kazakhstan), and mentions tribal affiliations and cultural/political differences. Fluent Mongolian with no Kazakh interference. Fully addresses the question with appropriate detail."
33,kazakh_cultural,qwen3,2,2,2,6,27.6,159,"Excellent answer. Factually accurate, covers all three zhuz with correct geographic locations and cultural/historical distinctions. Natural Mongolian fluency. Thorough explanation addressing the question fully."
33,kazakh_cultural,aya_expanse,0,0,0,0,8.32,29,"Response is completely garbled and unreadable. Does not identify the three Kazakh zhuz (Uly/Senior, Orta/Middle, Kishi/Junior) or their geographic/tribal differences. Appears to be machine translation gone wrong with nonsensical Mongolian text. Wrong content, wrong structure, incomprehensible."
34,kazakh_cultural,claude_opus_4.5,2,2,2,6,27.66,135,"Excellent response. Factually accurate (dates, major works, cultural significance all correct), fluent natural Mongolian with no code-switching or errors, and thoroughly addresses all aspects of the question with appropriate detail. Correctly identifies him as founder of modern Kazakh literature, mentions Kara Sözder, translations, music, and cultural legacy."
34,kazakh_cultural,gpt_5.2,2,2,2,6,29.39,256,"Excellent response. Factually accurate covering Abai's life (1845-1904), his role as poet/philosopher/composer/educator, his literary works including poetry, Kara Sozder, translations, and music. Culturally appropriate depth. Fluent Mongolian with proper technical vocabulary. Complete coverage of all aspects of the question."
34,kazakh_cultural,gemini_3_pro,2,2,2,6,19.87,135,"Excellent response. Factually accurate covering Abai's role as poet, composer, philosopher, founder of modern Kazakh literature. Mentions Қара сөз (Words of Edification), poetry themes, translations of Pushkin/Lermontov/Goethe, and music. Fluent Mongolian with proper terminology. Complete coverage of his literary legacy."
34,kazakh_cultural,grok_4.1,1,2,1,4,20.9,77,"Fluency natural Mongolian. Accuracy partial: correctly identifies Kara Sözder (Mэргэн үгс) as key work and mentions poetry/prose, but misses core facts—does not explicitly state Abai was founder of written Kazakh literature, first classic, poet/composer/philosopher, or that his poetry grew from folk culture and was mostly oral before him. Completeness partial: gives some literary details but omits central role in Kazakh identity and foundational status."
34,kazakh_cultural,deepseek_v3.2,2,2,2,6,11.7,210,"Excellent answer with correct facts (1845-1904, founder of modern Kazakh lit, Kara Sozder/Book of Words, themes, translations). Final Mongolian translation is natural and fluent. All key points covered thoroughly."
34,kazakh_cultural,llama_4_maverick,1,2,1,4,1.65,178,"Correct basic facts (poet, philosopher, composer, 1845, importance to Kazakh literature) but missing key details from reference answer: he founded written Kazakh literature, his Book of Words, encouragement of education/literacy/moral character to escape poverty/corruption, exploration of 19th century Kazakh national life, transition from oral to written poetry, connection to nomadic culture. Fluency is natural Mongolian. Completeness partial due to lack of depth on his specific literary legacy and cultural impact."
34,kazakh_cultural,qwen3,2,2,2,6,13.1,110,"Excellent response. Factually accurate with correct dates (1845-1904), correctly identifies Abai as poet/philosopher/composer/cultural reformer, mentions key works ('Қара сөздер'), translations of Pushkin/Lermontov, and thematic emphasis on humanism/knowledge/justice. Fluent natural Mongolian with no Kyrgyz markers. Fully addresses all parts of the question with cultural depth."
34,kazakh_cultural,aya_expanse,0,0,0,0,18.95,44,"Response is in Kyrgyz, not Mongolian. Uses 'кылып', 'жаңылыгына', lacks Mongolian-specific particles. Should be Mongolian. Wrong language = Fluency 0. Content also generic/incomplete = Accuracy 0, Completeness 0."
35,kazakh_cultural,claude_opus_4.5,0,2,1,3,10.36,45,"Completely wrong members listed. Ground truth: Meyrambek Besbaev, Saken Maygaziev, Kenzhebek Zhanabilov. Model gave: Erlan Kokeev, Baurzhan Ispanov, Madi Bayboldin, Hafiz Kuat. Fluent Mongolian but factually incorrect."
35,kazakh_cultural,gpt_5.2,1,2,2,5,4.11,25,"Lists 3 members fluently in Mongolian with good detail, but includes Qairat Baibosynov instead of Kenzhebek Zhanabilov—partially correct (2/3 members correct)."
35,kazakh_cultural,gemini_3_pro,2,2,2,6,11.65,21,"Correct members all named, natural Mongolian, fully addresses question"
35,kazakh_cultural,grok_4.1,0,2,1,3,16.74,53,"Completely wrong names. Reference says Meyrambek Besbaev, Saken Maygaziev, Kenzhebek Zhanabilov. Model gives Almas Keshubaev, Isabek Kemertaliev, Erbolat Sarkulov, Adilet Oralbaev, Azamat Zhanbyrbaev. Appears to be hallucinated or outdated info. Fluent Mongolian prose with disclaimer about changes, hence C=1 not 0."
35,kazakh_cultural,deepseek_v3.2,0,2,1,3,6.94,40,"Wrong members named. Answer says Arsen Gitinov and Madi Zhumabayev, but correct members are Meyrambek Besbaev, Saken Maygaziev, and Kenzhebek Zhanabilov. Fluency is natural Mongolian. Provides some detail but factually incorrect."
35,kazakh_cultural,llama_4_maverick,0,2,2,4,0.93,32,"Completely incorrect information. Claims MuzART is three sisters (Dina, Alma, Kuralai) when correct answer is three male musicians (Besbaev, Maygaziev, Zhanabilov). Pure hallucination. Fluent Mongolian, thorough format, but factually wrong."
35,kazakh_cultural,qwen3,0,2,1,3,8.6,71,"Completely incorrect: names Aidos Sarsenov and Saltanat Sarsenova instead of Meyrambek Besbaev, Saken Maygaziev, Kenzhebek Zhanabilov. Fluent Mongolian with no Kyrgyz markers. Partial completeness as it discusses the band but with wrong members."
35,kazakh_cultural,aya_expanse,0,0,0,0,4.41,39,"Response is completely garbled/broken Mongolian, unreadable. Does not answer the question at all. No band member names provided. Appears to be machine translation artifacts or corrupted text."
36,kazakh_cultural,claude_opus_4.5,2,2,2,6,13.43,71,"Perfect response: all 6 historical names correct with dates and meanings, fully accurate translation into Mongolian, natural fluency, thorough coverage"
36,kazakh_cultural,gpt_5.2,1,2,1,4,5.0,21,"Missing earliest names: Akmoly (1830), Akmolinsk started 1832 not 1961. Lists only Soviet-era onward. Fluent Mongolian, partial info."
36,kazakh_cultural,gemini_3_pro,2,2,2,6,14.68,39,"Correct, fluent, thorough. Covers all historical names with dates matching answer sheet."
36,kazakh_cultural,grok_4.1,1,2,1,4,11.44,56,"Fluency excellent. Accuracy partial: includes correct names (Astana, Nur-Sultan) but misses early names (Akmola/Akmolinsk 1830-1997, Tselinograd 1961-1992) and incorrectly adds Orynbor/Kyzyl-Orda (those were Kazakhstan SSR capitals, not today's capital city's names). Completeness partial: addresses question but incomplete list."
36,kazakh_cultural,deepseek_v3.2,1,2,1,4,12.3,57,"Correct cities mentioned (Nur-Sultan/Astana, Almaty, Kyzylorda) but misses many historical names: Akmoly, Akmolinsk, Tselinograd, Aqmola. Dates partially wrong (Almaty was capital 1929-97 is correct, but omits earlier names). Fluency is natural Mongolian. Partial completeness due to missing key names."
36,kazakh_cultural,llama_4_maverick,2,2,2,6,1.35,83,"Correct, covers all major name changes (Akmolinsk, Tselinograd, Akmola, Astana, Nur-Sultan, back to Astana). Natural Mongolian. Thorough."
36,kazakh_cultural,qwen3,2,2,2,6,18.35,58,"Fully accurate with all major name changes (Akmolinsk, Tselinograd, Akmola, Astana, Nur-Sultan, back to Astana). Fluent natural Mongolian. Complete coverage."
36,kazakh_cultural,aya_expanse,0,0,0,0,8.21,12,"Response is in Kyrgyz, not Mongolian. Uses 'менен' (Kyrgyz) instead of Mongolian grammar. Wrong language = Fluency 0. Content vague/generic, doesn't list capital names = Accuracy 0, Completeness 0."
37,kazakh_cultural,claude_opus_4.5,0,2,0,2,21.93,109,"Wrong language - this is actually a Kazakh cultural dish (Nauryz kozhe), not Mongolian. The question asks how to make a Kazakh dish. The response is fluent Mongolian but describes a Kazakh recipe, not answering what was asked. Kazakh answer sheet shows detailed cooking instructions with appliance settings; this gives generic steps without cultural context or proper detail."
37,kazakh_cultural,gpt_5.2,1,2,1,4,28.61,187,"Response is in Mongolian as required. Content describes a generic fermented dairy soup with grains, which is conceptually related to Navruz köje but lacks key Kazakh-specific details: no mention of 7 ingredients (symbolic for Navruz), missing specific Kazakh dairy products like қурт or süzbe, no cultural context. Recipe steps are clear and natural but too generic. Partial accuracy due to missing cultural/symbolic significance and incomplete ingredient list."
37,kazakh_cultural,gemini_3_pro,1,0,1,2,19.68,106,"Answer is in ENGLISH, not Mongolian. Should be fluent Mongolian. Content partially correct (describes basic cooking steps) but incomplete—misses key ingredients (7 components: water, meat, millet, wheat, rice, fat, kefir, salt) and lacks cultural context. Fluency=0 due to wrong language. Final Mongolian fragment is cut off mid-sentence."
