question_id,category,model,accuracy,fluency,completeness,total,response_time,response_length,notes
14,neutral_reasoning,deepseek_v3.2,2,2,2,6,18.22,46,Excellent response. Correctly explains the logic puzzle with proper reasoning. Natural Mongolian fluency. Adds helpful context about using an umbrella or getting help on rainy days.
14,neutral_reasoning,llama_4_maverick,2,2,2,6,1.24,53,"Correct logic and answer, natural Mongolian, thorough explanation"
14,neutral_reasoning,qwen3,2,2,2,6,6.05,31,Correct logic and final answer. Fluent Mongolian. Fully addresses the question with proper explanation.
14,neutral_reasoning,aya_expanse,0,0,0,0,7.59,31,"Response is completely garbled, unreadable, appears to be machine translation gone wrong. Contains nonsensical phrases like 'хүн баримтлагдсан' (person was detained/held) repeated. Does not answer the question at all. Wrong answer, broken language, minimal content."
15,neutral_reasoning,claude_opus_4.5,2,2,2,6,21.31,154,"Perfect: correct logic, correct final answer (30+15=45), explained step-by-step with visual diagrams in fluent Mongolian. Full marks."
15,neutral_reasoning,gpt_5.2,2,2,2,6,8.72,99,Correct logic and final answer (45 min). Natural Mongolian with clear step-by-step explanation. Fully addresses the question.
15,neutral_reasoning,gemini_3_pro,2,2,2,6,21.98,103,Correct logic and final answer. Clear step-by-step explanation. Natural Mongolian. Response appears cut off at the very end ('бу') but all essential information is present.
15,neutral_reasoning,grok_4.1,1,2,1,4,12.2,44,Logic partially correct but explanation unclear. States '30 min later rope A burns completely' without explaining how to achieve this (lighting both ends). Final answer 45min is correct but reasoning incomplete. Mongolian is fluent and natural.
15,neutral_reasoning,deepseek_v3.2,2,2,2,6,14.19,90,Correct logic and answer with full step-by-step explanation in natural Mongolian
15,neutral_reasoning,llama_4_maverick,2,2,2,6,1.45,68,Correct logic and final answer. Natural Mongolian phrasing. Fully explains the two-rope timing method.
15,neutral_reasoning,qwen3,2,2,2,6,31.97,113,"Correct logic and answer, natural Mongolian, thorough step-by-step explanation"
15,neutral_reasoning,aya_expanse,0,1,0,1,7.8,36,"Completely incorrect logic and answer. The model attempts mathematical operations (60/2=30, 105-30=75) that don't solve the rope-burning puzzle. The correct answer requires lighting one rope from one end and the other rope from both ends simultaneously. The Mongolian text is understandable but the content is wrong."
16,neutral_reasoning,claude_opus_4.5,2,2,2,6,12.82,111,Perfect answer with clear explanation and correct reasoning in fluent Mongolian. Visually engaging with emojis. Pipeline C5 delivered high quality.
16,neutral_reasoning,gpt_5.2,2,2,2,6,3.7,35,"Correct answer (3), clear explanation, natural Mongolian"
16,neutral_reasoning,gemini_3_pro,2,2,2,6,11.18,11,
16,neutral_reasoning,grok_4.1,2,2,2,6,9.02,55,"Correct answer (3) with clear logical explanation showing the spatial arrangement. Natural Mongolian phrasing, proper grammar and vocabulary."
16,neutral_reasoning,deepseek_v3.2,2,2,2,6,20.8,160,"Pipeline C5: Final Mongolian answer is correct (3 fish), well-explained with clear logic. All translation steps visible but final portion is fluent, accurate, and thorough."
16,neutral_reasoning,llama_4_maverick,2,2,2,6,0.83,48,"Correct answer (3), clear logical explanation, natural Mongolian fluency"
16,neutral_reasoning,qwen3,2,2,2,6,34.13,137,Correct answer (3) with thorough logical explanation in natural Mongolian. The pipeline approach worked well here.
16,neutral_reasoning,aya_expanse,0,1,0,1,4.42,27,"Wrong answer (5 instead of 3). Logic is confused and contradictory. Fluency broken with garbled phrasing ('бүрэн 1 нугас дурдаж буйга мөнхбая' is nonsensical), but target language (Mongolian) is correct and partially understandable."
17,neutral_reasoning,claude_opus_4.5,2,2,2,6,9.74,101,"Correct answer CABDE with clear logical steps, well-formatted table, natural Mongolian"
17,neutral_reasoning,gpt_5.2,2,2,2,6,4.31,49,
17,neutral_reasoning,gemini_3_pro,2,2,2,6,18.45,80,"Correct answer CABDE with clear logical explanation, fluent Mongolian, fully addresses the question."
17,neutral_reasoning,grok_4.1,2,2,2,6,12.91,49,Correct answer CABDE with clear logical explanation in natural Mongolian
17,neutral_reasoning,deepseek_v3.2,2,2,2,6,9.13,29,"Correct final answer CABDE, clear logical explanation, natural Mongolian"
17,neutral_reasoning,llama_4_maverick,2,2,2,6,1.57,111,Perfect logical reasoning and correct final answer CABDE in Mongolian. Shows full step-by-step work.
17,neutral_reasoning,qwen3,2,2,2,6,15.35,79,"Correct answer (CABDE), clear logical breakdown, natural Mongolian phrasing. Excellent response."
17,neutral_reasoning,aya_expanse,0,1,0,1,5.34,62,Wrong answer: says '2' instead of CABDE. Logic is incoherent. Fluency passable but confusing phrasing. Minimal useful content.
18,neutral_reasoning,claude_opus_4.5,2,2,2,6,13.03,94,"Perfect logic, correct answer, natural Mongolian with proper formatting"
18,neutral_reasoning,gpt_5.2,2,2,2,6,4.11,35,Perfect answer with clear logical reasoning for both cases. Natural Mongolian.
18,neutral_reasoning,gemini_3_pro,2,2,2,6,15.36,67,Perfect answer with complete logical explanation covering both cases. Natural Mongolian with no errors.
18,neutral_reasoning,grok_4.1,0,2,2,4,21.31,80,"Fluent Mongolian with detailed reasoning, but answer is factually wrong. The correct answer is 'Yes' (via case analysis: if Anne is married she looks at George(unmarried); if Anne is unmarried then Jack(married) looks at Anne(unmarried)). Model incorrectly concluded 'No' due to flawed logic."
18,neutral_reasoning,deepseek_v3.2,0,0,0,0,11.69,45,Model responded in English instead of Mongolian. Fluency=0 per Rule 4. Content is correct but wrong language renders response unusable for this condition.
18,neutral_reasoning,llama_4_maverick,2,2,2,6,1.74,81,Perfect logic and correct answer with full case-by-case reasoning. Natural Mongolian with no errors.
18,neutral_reasoning,qwen3,2,2,2,6,17.59,86,Perfect answer with clear logical explanation covering both cases. Mongolian is fluent and natural.
18,neutral_reasoning,aya_expanse,0,1,1,2,8.81,35,"Logic is completely wrong. States Jack and George are unmarried, contradicting the premise. Final answer unclear but reasoning is broken. Fluency: understandable but awkward phrasing."
19,neutral_reasoning,claude_opus_4.5,2,2,2,6,10.56,60,Correct logic and final answer (Yes/Tийм). Good explanation of syllogism. Natural Mongolian.
19,neutral_reasoning,gpt_5.2,2,2,2,6,2.55,33,Correct logic and answer. Natural Mongolian. Provides thorough explanation of the syllogism.
19,neutral_reasoning,gemini_3_pro,2,2,2,6,20.29,33,"Perfect answer. Correct logic, correct conclusion (Yes), natural Mongolian, thorough explanation."
19,neutral_reasoning,grok_4.1,2,2,2,6,13.94,52,Correct logic and answer with excellent cultural-historical context about Socrates. Reads naturally in Mongolian.
19,neutral_reasoning,deepseek_v3.2,2,2,2,6,144.35,25,"Perfect response. Correct answer (Yes/Тийм ээ), with clear logical explanation showing sound deductive reasoning. Natural Mongolian, fully addresses the question."
19,neutral_reasoning,llama_4_maverick,2,2,2,6,1.44,69,"Correct final answer (Тийм) with clear logical reasoning. Natural Mongolian, fully addresses the syllogism."
19,neutral_reasoning,qwen3,2,2,2,6,7.94,33,"Correct answer 'Тийм' with clear logical explanation. Fluent native Mongolian, fully addresses the question."
19,neutral_reasoning,aya_expanse,0,0,0,0,18.95,13,Response is garbled/nonsensical in Mongolian. Does not answer yes/no. Appears to be machine translation error or hallucination. Completely fails the task.
20,neutral_reasoning,claude_opus_4.5,2,2,2,6,12.39,73,Perfect logic explanation and correct final answer 'ҮГҮЙ' (No). Natural Mongolian with good logical structure.
20,neutral_reasoning,gpt_5.2,2,2,2,6,4.03,51,"Correct answer (No), correct logic (denying the antecedent fallacy), natural Mongolian with proper technical terms, thorough explanation"
20,neutral_reasoning,gemini_3_pro,2,2,2,6,17.65,54,Correct answer (Үгүй/No) with excellent logical explanation in fluent Mongolian. Clearly identifies the logical fallacy (denying the antecedent) and explains why the conclusion is invalid.
20,neutral_reasoning,grok_4.1,2,2,2,6,12.0,72,"Correct answer (No), correct logical reasoning (denying the antecedent fallacy), natural Mongolian phrasing, thorough explanation"
20,neutral_reasoning,deepseek_v3.2,2,2,2,6,75.37,54,Correct answer (No) with thorough logical explanation identifying 'denying the antecedent' fallacy. Natural Mongolian fluency. Exceeds expectations.
20,neutral_reasoning,llama_4_maverick,2,2,2,6,1.55,85,Correct logic and correct final answer (Үгүй = No). Full logical explanation provided. Natural Mongolian fluency.
20,neutral_reasoning,qwen3,2,2,2,6,15.07,79,"Perfect. Correct logic, correct final answer 'Үгүй', thorough explanation in natural Mongolian."
20,neutral_reasoning,aya_expanse,0,0,0,0,4.42,23,"Wrong language translation: instead of answering the logic question, the model just re-translates the question into broken Mongolian with 'бодой тоо' (apparently means 'real number'). No answer provided. Scores 0/0/0."
21,neutral_technical,claude_opus_4.5,2,2,2,6,15.5,120,"Excellent technical explanation with clear table, examples, and metaphors. Fully accurate, natural Mongolian, thorough coverage of TCP vs UDP differences."
21,neutral_technical,gpt_5.2,2,2,2,6,17.68,139,"Excellent technical explanation covering all key TCP/UDP differences: reliability, ordering, flow/congestion control, overhead, use cases. Natural Mongolian with proper technical vocabulary. Thorough and well-structured."
21,neutral_technical,gemini_3_pro,2,2,1,5,20.34,104,"Accurate technical explanation of TCP vs UDP with correct Mongolian terminology. Fluent and natural phrasing. However, response is incomplete - cuts off mid-sentence in UDP section and never finishes the explanation, missing key details like use cases for UDP."
21,neutral_technical,grok_4.1,2,2,2,6,17.62,151,Excellent technical explanation with comprehensive comparison table covering all key differences between TCP and UDP. Terminology is accurate and appropriate for Mongolian technical writing. Natural phrasing throughout.
21,neutral_technical,deepseek_v3.2,2,2,2,6,14.55,73,Excellent technical explanation covering all key TCP/UDP differences with clear examples. Natural Mongolian phrasing throughout.
21,neutral_technical,llama_4_maverick,2,2,2,6,2.88,142,"Excellent response. Covers all key differences (connection-oriented vs connectionless, reliability, speed, use cases) with clear examples. Natural Mongolian. Matches or exceeds reference answer quality."
21,neutral_technical,qwen3,2,2,2,6,20.59,137,"Excellent answer: covers connection-oriented vs connectionless, reliability, speed tradeoffs, error checking, use cases. All factually correct and well-organized. Natural Mongolian fluency."
21,neutral_technical,aya_expanse,0,0,0,0,16.09,40,Response is garbled/unintelligible. Contains broken Mongolian mixed with unclear terminology. Does not provide coherent explanation of TCP vs UDP differences. Appears to be machine translation errors or corrupted text.
22,neutral_technical,claude_opus_4.5,2,2,2,6,22.65,133,"Excellent technical explanation with correct definition, clear methodology, practical examples across multiple fields, and culturally appropriate presentation. Fully addresses when and how Monte Carlo simulations are used."
22,neutral_technical,gpt_5.2,2,2,2,6,16.34,93,"Excellent response. Defines Monte Carlo simulation correctly, explains when to use it (uncertain inputs, no closed-form solutions, need probability distributions), and provides comprehensive real-world examples across finance, engineering, project management, physics, and operations. Fluent Mongolian. Complete."
22,neutral_technical,gemini_3_pro,2,2,2,6,78.65,146,"Excellent response. Covers definition, mechanism, and multiple use cases with proper technical terminology. Fluency is natural Mongolian. Fully addresses all parts of the question."
22,neutral_technical,grok_4.1,2,2,2,6,15.57,106,"Excellent technical explanation in Mongolian covering definition, applications across finance/physics/operations research, and methodology. Comprehensive and accurate."
22,neutral_technical,deepseek_v3.2,2,2,2,6,11.99,57,"Excellent technical explanation in Mongolian. Accurately describes Monte Carlo simulation as a computational method using random sampling for uncertainty modeling. Provides strong examples of application fields (finance, engineering, supply chain, project management, research). Fluency is native-level with proper technical vocabulary. Completeness covers both what it is and when it's used."
22,neutral_technical,llama_4_maverick,1,2,1,4,3.49,95,"Partially correct. Explains Monte Carlo as computational algorithm for modeling complex systems under uncertainty, mentions finance/engineering/physics applications. Missing key detail that it uses random variables and multiple probability simulations. Fluency is natural Mongolian. Completeness is partial - addresses what and when but lacks depth on how it works."
22,neutral_technical,qwen3,2,2,2,6,12.3,104,"Excellent response. Accurate definition covering random sampling and probabilistic outcomes. Natural, fluent Mongolian with proper technical vocabulary. Thorough coverage with specific use cases across finance, engineering, project management, physics. Fully addresses all aspects of the question."
22,neutral_technical,aya_expanse,0,0,0,0,12.4,60,Completely garbled/broken Mongolian. Unintelligible text with no coherent meaning. Fails to explain Monte Carlo simulation or when it is used. Wrong script errors and nonsensical phrasing throughout.
23,neutral_technical,claude_opus_4.5,2,2,2,6,14.46,90,"Excellent technical explanation with correct biochemistry, proper Mongolian scientific terminology, clear structure covering light-dependent and light-independent reactions, and accurate overall equation."
23,neutral_technical,gpt_5.2,2,2,2,6,21.57,162,"Excellent technical explanation covering light-dependent reactions, electron transport, ATP/NADPH formation, Calvin cycle, and CO2 fixation. Accurate terminology in Mongolian (тилакойд, хлорофилл, RuBisCO, etc.). Natural scientific writing. Fully addresses the question with proper detail."
23,neutral_technical,gemini_3_pro,1,2,1,4,57.37,70,"Correct main mechanism but lacks key details from reference: misses mention of 6CO2+6H2O→C6H12O6+6O2 equation, photosynthetic efficiency emphasis, glucose as vital energy source fueling metabolic activities, and oxygen as by-product essential for human/animal life. Chemical formulas included ($H_2O$, $CO_2$) but equation incomplete. Fluent native Mongolian. Partial depth."
23,neutral_technical,grok_4.1,2,2,2,6,14.65,100,"Excellent technical answer in fluent Mongolian. Correctly explains light-dependent reactions (photophosphorylation, ATP/NADPH production, photolysis), light-independent reactions (Calvin cycle), includes correct equation, uses proper terminology (тилакоид, хлорофилл, фотолиз, стром, энзим). Covers all key concepts from reference answer and adds appropriate detail."
23,neutral_technical,deepseek_v3.2,2,2,2,6,84.19,138,"Excellent technical explanation with all key steps, correct equation, proper Mongolian terminology"
23,neutral_technical,llama_4_maverick,2,2,2,6,2.88,59,"Correct explanation covering light absorption by chlorophyll, conversion to ATP/NADPH, and production of glucose and oxygen. Natural Mongolian with proper scientific vocabulary. Thorough coverage of the photosynthesis process."
23,neutral_technical,qwen3,2,2,2,6,14.76,137,"Excellent technical explanation in fluent Mongolian covering light-dependent/independent reactions, chemical equation, ATP/NADPH, and Calvin cycle. Fully accurate and thorough."
23,neutral_technical,aya_expanse,0,0,0,0,14.56,35,Complete gibberish. Unreadable garbled text with no meaningful content about photosynthesis. Contains fabricated/nonsense words. Machine translation catastrophic failure.
24,neutral_technical,claude_opus_4.5,2,2,2,6,21.6,112,"Excellent technical answer covering all major primitives: cryptographic (hash functions, digital signatures, HTLCs), Bitcoin script (multisig, timelocks), and security mechanisms (revocation keys, commitment/penalty transactions, onion routing). Matches reference answer comprehensively. Mongolian is natural and fluent."
24,neutral_technical,gpt_5.2,2,2,2,6,20.96,240,"Excellent technical answer covering all major Lightning security primitives: HTLCs, time-locks (CLTV/CSV), revocation mechanism, multisig, hash functions, watchtowers. Fluent Mongolian with proper technical terminology. Thorough and well-structured."
24,neutral_technical,gemini_3_pro,2,2,2,6,21.2,142,"Excellent technical answer covering multisig wallets, HTLCs (with hash and timelock details), penalty transactions, and revocable commitment transactions. Matches ground truth comprehensively. Mongolian is natural and fluent with proper technical vocabulary. Response is thorough and well-structured despite being cut off at the end (likely due to length limit, not model error)."
24,neutral_technical,grok_4.1,2,2,2,6,19.98,150,"Excellent technical answer in correct Mongolian. Covers HTLC (implied via timelock mechanisms), revocation/penalty transactions, ECDSA/Schnorr signatures, P2WSH, and watchtowers. More detailed than reference answer. All key primitives present."
24,neutral_technical,deepseek_v3.2,2,2,2,6,14.04,98,"Excellent technical response covering HTLCs, multisig wallets, revocable contracts, PTLCs, and ECC with proper Mongolian terminology. Matches reference answer's core mechanisms and adds relevant detail."
24,neutral_technical,llama_4_maverick,1,2,1,4,2.06,115,"HTLCs correct but missing key details (penalty transactions, onion routing/Sphinx, revocable channels). Public key crypto and digital signatures too generic—not Lightning-specific primitives. Natural Mongolian. Partial accuracy and completeness."
24,neutral_technical,qwen3,2,2,2,6,21.05,201,"Excellent technical answer covering all core security primitives (HTLCs, signatures, PKC, timelocks, revocable transactions). Matches reference answer closely. Natural Mongolian with proper technical vocabulary."
24,neutral_technical,aya_expanse,0,0,0,0,33.39,86,"Complete nonsense. Repetitive gibberish with phrases like 'мөрөөдөр' (dream) repeated nonsensically. No actual technical content about HTLCs, penalty transactions, onion routing, or payment channels. Wrong language processing or severe translation failure. Unreadable and entirely incorrect."
25,neutral_technical,claude_opus_4.5,1,2,1,4,32.39,203,"Content is technically sound and well-structured but significantly over-delivers beyond the simple reference answer. English reference mentions only 'avoiding parallel routing, spacing traces, decoupling caps'—this response provides extensive PCB design guidance including impedance control, layer stacking, routing rules, via management, termination strategies, and detailed tool lists. While accurate and fluent in Mongolian, it's far more comprehensive than needed for this question, suggesting possible hallucination or over-elaboration. Partial credit for accuracy/completeness due to mismatch with reference scope."
25,neutral_technical,gpt_5.2,0,0,0,0,31.35,0,No response provided to evaluate. Empty output.
25,neutral_technical,gemini_3_pro,1,0,1,2,27.87,101,"Wrong language - response in English not Mongolian. Content partially correct (impedance control, stackup, spacing) but incomplete (cut off mid-sentence). Missing decoupling caps mentioned in answer key."
25,neutral_technical,grok_4.1,2,2,2,6,31.75,153,Excellent technical response with correct PCB signal integrity practices and tools. Fluent Mongolian with proper technical vocabulary. Comprehensive coverage exceeds basic reference answer.
25,neutral_technical,deepseek_v3.2,1,2,2,5,86.24,165,"Content is partially correct—mentions impedance control, layer stacking, via placement, simulation tools (HFSS, Sigrity, TDR, VNA), which are relevant to SI. However, the reference answer emphasizes simpler practical rules (avoid parallel routing, space traces, decouple caps). This response is more advanced/comprehensive than the reference but doesn't directly match the key points. Fluency is excellent—natural Mongolian technical writing. Completeness is thorough with detailed explanation of tools and methods. Partial accuracy because it over-elaborates beyond the reference's scope."
25,neutral_technical,llama_4_maverick,1,2,1,4,3.43,163,"Content is correct and relevant but does not match the specific concise answer expected (parallel routing, trace spacing, decoupling caps). Response is overly detailed for what was asked. Fluency is natural Mongolian. Partially complete as it addresses signal integrity broadly but misses the specific simple techniques in the reference."
25,neutral_technical,qwen3,1,2,2,5,38.26,227,"Response is fluent Mongolian and thorough, covering impedance control, crosstalk reduction, stackup, routing, vias, decoupling caps, and tools (HyperLynx, Ansys, Cadence). However, reference answer is much simpler: 'avoid parallel routing, space traces, decouple caps.' This response goes far beyond but doesn't explicitly state 'avoid parallel routing' as a primary point. Partial accuracy for missing the specific simple framing of the reference."
25,neutral_technical,aya_expanse,0,0,0,0,18.96,35,Response is completely wrong - not about PCB signal integrity at all. Appears to be generic bullet points unrelated to the technical question about multi-layer board design. Wrong content entirely.
26,neutral_technical,claude_opus_4.5,2,2,2,6,14.44,72,"Excellent response. Core answer correct (уушигны сурфактант = pulmonary surfactant). Natural Mongolian phrasing. Goes beyond minimum with detailed breakdown of surfactant composition, function, storage, and regenerative capacity. All scientifically accurate. No errors detected."
26,neutral_technical,gpt_5.2,2,2,2,6,8.41,53,"Excellent technical answer in correct Mongolian. Core answer 'уушгины сурфактант' is accurate. Goes beyond baseline by correctly detailing phospholipids (DPPC), surfactant proteins, surface tension reduction, collapse prevention, and repair functions. All terminology is appropriate and natural."
26,neutral_technical,gemini_3_pro,2,2,2,6,12.4,37,Correct answer (pulmonary surfactant). Fluent Mongolian with proper technical terminology. Goes beyond basic answer with helpful detail about lipid-protein composition and function.
26,neutral_technical,grok_4.1,2,2,2,6,9.44,64,"Excellent answer. Correctly identifies pulmonary surfactant as the main product, then provides extensive medically accurate detail about surfactant functions (reducing surface tension, preventing atelectasis, facilitating expansion, immune regulation). Also mentions cytokines/growth factors and repair capacity. Goes well beyond the basic answer with relevant technical depth. Language is natural medical Mongolian terminology."
26,neutral_technical,deepseek_v3.2,2,2,2,6,16.19,107,"Perfect answer. Pipeline format visible but final Mongolian answer is correct (pulmonary surfactant/уушигны гадаргуугийн идэвхт бодис), fluent, and thoroughly explains function with appropriate medical terminology."
26,neutral_technical,llama_4_maverick,2,2,2,6,1.23,63,"Correct answer (pulmonary surfactant), natural Mongolian, thorough explanation of type II pneumocytes' function"
26,neutral_technical,qwen3,2,2,2,6,11.0,61,Correct answer (pulmonary surfactant) with excellent additional detail on composition and function. Natural Mongolian phrasing with proper technical vocabulary.
26,neutral_technical,aya_expanse,0,0,0,0,13.23,45,"Completely garbled text, unreadable in Mongolian or any language. Contains nonsensical phrases like 'бүрэн туслах эргээс нөхөр сүрчтэй төрөлт чөлөмт'. Does not answer the question about pulmonary surfactant. Pipeline translation failure."
27,neutral_technical,claude_opus_4.5,2,2,2,6,15.06,101,"Excellent technical response with correct definitions, clear table comparison, and proper Mongolian terminology. Covers all key differences accurately."
27,neutral_technical,gpt_5.2,2,2,2,6,11.38,118,"Excellent technical response. Correctly explains diffusion (any particles, high to low concentration, no membrane required) and osmosis (water only, semipermeable membrane required, water moves toward higher solute concentration). Includes all key distinctions. Mongolian terminology is accurate and natural. Fully addresses the question with appropriate depth."
27,neutral_technical,gemini_3_pro,2,2,2,6,149.84,99,"Excellent response. Goes beyond reference answer with proper terminology (идэвхгүй тээвэрлэлт, хагас нэвтрүүлэгч мембран, концентраци) and structured explanation. Covers diffusion vs osmosis thoroughly with correct distinguishing features. Natural Mongolian phrasing throughout."
27,neutral_technical,grok_4.1,2,2,2,6,15.16,104,"Excellent technical explanation in fluent Mongolian. Covers passive transport, diffusion vs osmosis mechanisms, membrane requirement, and includes concrete examples. Goes beyond reference answer with added detail about concentration gradients and examples, which enhances rather than detracts. All Mongolian-specific letters present (Ө, Ү). Natural phrasing."
